Beans, Gourd & Cucumber, Hair Conditioner, Organic Dals & Pulses, Organic F&V, Organic Flours, Organic Rice & Rice Products, Organic Salt,Sugar & Jaggery, Other Vegetables, Root Vegetables,,,,,,,,,,,,,,,,,
Banana, Beans, Cashews, Moong Dal, Other Dals, Other Vegetables, Raisins, Root Vegetables, Sooji & Rava,,,,,,,,,,,,,,,,,,,
Beans, Gourd & Cucumber, Other Dals, Other Dry Fruits, Root Vegetables, Sooji & Rava, Sugar,,,,,,,,,,,,,,,,,,,,,
Cream Biscuits, Exotic Vegetables, Gourd & Cucumber, Other Vegetables, Root Vegetables, Whole Spices, Yogurt & Lassi,,,,,,,,,,,,,,,,,,,,,
Banana, Beans, Bread, Exotic Vegetables, Organic Dals & Pulses, Other Dry Fruits, Other Vegetables, Root Vegetables, Toor Dal,,,,,,,,,,,,,,,,,,,
Avalakki / Poha, Health Drinks, Other Vegetables,,,,,,,,,,,,,,,,,,,,,,,,,
Banana, Glucose, Marie & Milk Biscuits, Maida, Moong Dal, Raw Rice, Toor Dal,,,,,,,,,,,,,,,,,,,,,
Banana, Bread, Namkeen, Snacky Nuts,,,,,,,,,,,,,,,,,,,,,,,,
Banana, Chinese Noodles, Cream Biscuits, Health Drinks, Moong Dal, Other Oils, Sugar, Vermicelli,,,,,,,,,,,,,,,,,,,,
Shaving Blade & Razors,,,,,,,,,,,,,,,,,,,,,,,,,,,
Banana, Bread, Other Vegetables,,,,,,,,,,,,,,,,,,,,,,,,,
Moong Dal, Raw Rice, Sunflower Oils, Toor Dal,,,,,,,,,,,,,,,,,,,,,,,,
Cashews, Cream Biscuits, Ghee, Moong Dal, Other Dals, Other Vegetables, Rice Flour, Sooji & Rava, Sunflower Oils, Toor Dal,,,,,,,,,,,,,,,,,,
Hair Colors & Dyes,,,,,,,,,,,,,,,,,,,,,,,,,,,
Beans,,,,,,,,,,,,,,,,,,,,,,,,,,,
Boiled Rice, Exotic Vegetables, Gourd & Cucumber, Namkeen, Organic F&V, Other Dals, Other Dry Fruits, Other Vegetables, Root Vegetables, Sooji & Rava,,,,,,,,,,,,,,,,,,
Banana, Gourd & Cucumber, Organic F&V, Other Vegetables, Root Vegetables, Toor Dal,,,,,,,,,,,,,,,,,,,,,,
Organic F&V, Other Vegetables, Root Vegetables,,,,,,,,,,,,,,,,,,,,,,,,,
Besan, Cream Biscuits, Namkeen, Other Oils, Other Vegetables, Raw Peanuts, Toor Dal,,,,,,,,,,,,,,,,,,,,,
Cream Biscuits, Wafers,,,,,,,,,,,,,,,,,,,,,,,,,,
Beans, Gourd & Cucumber, Other Vegetables, Root Vegetables,,,,,,,,,,,,,,,,,,,,,,,,
Beans, Bread, Other Vegetables, Root Vegetables,,,,,,,,,,,,,,,,,,,,,,,,
Bread,,,,,,,,,,,,,,,,,,,,,,,,,,,
Beans, Diapers & Wipes, Gourd & Cucumber, Other Vegetables, Root Vegetables,,,,,,,,,,,,,,,,,,,,,,,
Beans, Bread, Other Vegetables,,,,,,,,,,,,,,,,,,,,,,,,,
Banana, Beans, Bread, Butter & Cream, Diapers & Wipes, Glucose, Marie & Milk Biscuits, Gourd & Cucumber, Ground Coffee, Other Vegetables,,,,,,,,,,,,,,,,,,
Other Vegetables, Root Vegetables,,,,,,,,,,,,,,,,,,,,,,,,,,
Beans, Bread, Gourd & Cucumber, Other Vegetables, Root Vegetables,,,,,,,,,,,,,,,,,,,,,,,
Bread, Other Vegetables,,,,,,,,,,,,,,,,,,,,,,,,,,
Beans, Bread, Pain Relievers, Ready Baking Mixes, Root Vegetables,,,,,,,,,,,,,,,,,,,,,,,
Banana, Beans, Cotton & Bandages, Gourd & Cucumber, Health Drinks, Ice Creams & Desserts, Oats, Organic Masalas & Spices, Organic Salt,Sugar & Jaggery, Other Vegetables, Regular Pasta, Root Vegetables, Sugar Cubes, Vermicelli,,,,,,,,,,,,,
Beans, Rice Flour, Root Vegetables, Toor Dal,,,,,,,,,,,,,,,,,,,,,,,,
Bread, Gourd & Cucumber, Other Vegetables,,,,,,,,,,,,,,,,,,,,,,,,,
Cream Biscuits, Ground Coffee, Olive Oils,,,,,,,,,,,,,,,,,,,,,,,,,
Banana, Beans, Diapers & Wipes, Exotic Vegetables, Gourd & Cucumber, Ground Coffee, Other Vegetables, Root Vegetables,,,,,,,,,,,,,,,,,,,,
Beans, Other Vegetables,,,,,,,,,,,,,,,,,,,,,,,,,,
Banana, Beans, Cream Biscuits, Root Vegetables,,,,,,,,,,,,,,,,,,,,,,,,
Banana, Bread, Exotic Vegetables, Other Vegetables, Root Vegetables,,,,,,,,,,,,,,,,,,,,,,,
Beans, Bread, Gourd & Cucumber, Other Vegetables,,,,,,,,,,,,,,,,,,,,,,,,
Beans, Bread, Cream Biscuits, Other Vegetables, Root Vegetables,,,,,,,,,,,,,,,,,,,,,,,
Diapers & Wipes, Ground Coffee, Rice Flour,,,,,,,,,,,,,,,,,,,,,,,,,
Beans, Bread, Gourd & Cucumber, Other Dals, Other Rice Products, Raw Peanuts, Root Vegetables, Toor Dal, Urad Dal,,,,,,,,,,,,,,,,,,,
Chilli & Soya Sauces, Chinese Noodles, Jams & Sauces,,,,,,,,,,,,,,,,,,,,,,,,,
Beans, Exotic Vegetables, Instant Noodles, Instant Pastas, Other Dals, Other Vegetables, Root Vegetables,,,,,,,,,,,,,,,,,,,,,
Avalakki / Poha, Beans, Maida, Other Vegetables, Raw Rice, Rice Flour, Root Vegetables, Toor Dal, Whole Spices,,,,,,,,,,,,,,,,,,,
Exotic Vegetables,,,,,,,,,,,,,,,,,,,,,,,,,,,
Cream Biscuits,,,,,,,,,,,,,,,,,,,,,,,,,,,
Cream Biscuits,,,,,,,,,,,,,,,,,,,,,,,,,,,
Beans, Root Vegetables,,,,,,,,,,,,,,,,,,,,,,,,,,
Beans, Exotic Vegetables, Gourd & Cucumber, Liquid Soaps & Bars, Other Vegetables, Root Vegetables, Whole Spices,,,,,,,,,,,,,,,,,,,,,
Ground Coffee, Other Vegetables, Raw Peanuts, Root Vegetables, Snacky Nuts, Sooji & Rava, Toor Dal, Whole Spices,,,,,,,,,,,,,,,,,,,,
Banana, Gourd & Cucumber, Root Vegetables,,,,,,,,,,,,,,,,,,,,,,,,,
Bread, Glucose, Marie & Milk Biscuits, Gourd & Cucumber, Health Drinks, Other Vegetables,,,,,,,,,,,,,,,,,,,,,,
Banana, Beans, Root Vegetables, Sunflower Oils, Toor Dal,,,,,,,,,,,,,,,,,,,,,,,
Beans, Cashews, Glucose, Marie & Milk Biscuits, Organic Rice & Rice Products, Other Vegetables,,,,,,,,,,,,,,,,,,,,,,
Beans, Gourd & Cucumber, Organic Masalas & Spices, Other Dals, Other Vegetables, Raw Rice, Root Vegetables, Sunflower Oils, Toor Dal, Urad Dal,,,,,,,,,,,,,,,,,,
Yogurt & Lassi,,,,,,,,,,,,,,,,,,,,,,,,,,,
Banana,,,,,,,,,,,,,,,,,,,,,,,,,,,
Banana, Beans, Exotic Vegetables, Gourd & Cucumber, Liquid Soaps & Bars, Other Dals, Root Vegetables,,,,,,,,,,,,,,,,,,,,,
Beans, Boiled Rice, Bread, Gourd & Cucumber, Ground Coffee, Other Vegetables, Root Vegetables, Sooji & Rava, Whole Spices,,,,,,,,,,,,,,,,,,,
Banana, Beans, Exotic Vegetables, Gourd & Cucumber, Other Vegetables, Root Vegetables,,,,,,,,,,,,,,,,,,,,,,
Avalakki / Poha, Banana, Exotic Vegetables, Sugar, Sunflower Oils, Whole Spices,,,,,,,,,,,,,,,,,,,,,,
Curd, Exotic Vegetables, Phenyles & Acids, Yogurt & Lassi,,,,,,,,,,,,,,,,,,,,,,,,
Beans, Bread, Ghee, Other Vegetables, Ready Baking Mixes,,,,,,,,,,,,,,,,,,,,,,,
Banana, Beans, Exotic Vegetables, Gourd & Cucumber, Instant Noodles, Other Vegetables, Root Vegetables,,,,,,,,,,,,,,,,,,,,,
Banana, Beans, Gourd & Cucumber, Other Vegetables, Root Vegetables, Sugar,,,,,,,,,,,,,,,,,,,,,,
Banana, Gourd & Cucumber, Other Vegetables, Root Vegetables, Whole Spices, Yogurt & Lassi,,,,,,,,,,,,,,,,,,,,,,
Banana, Beans, Gourd & Cucumber, Root Vegetables, Urad Dal,,,,,,,,,,,,,,,,,,,,,,,
Banana, Beans, Gourd & Cucumber, Instant Noodles, Instant Pastas, Raw Rice, Root Vegetables,,,,,,,,,,,,,,,,,,,,,
Gourd & Cucumber, Health Drinks, Toor Dal, Urad Dal,,,,,,,,,,,,,,,,,,,,,,,,
Banana, Beans, Bread, Other Dals,,,,,,,,,,,,,,,,,,,,,,,,
Boiled Rice,,,,,,,,,,,,,,,,,,,,,,,,,,,
Banana, Beans, Bread, Raw Rice, Root Vegetables, Sugar,,,,,,,,,,,,,,,,,,,,,,
Beans, Cream Biscuits, Gourd & Cucumber, Health Drinks, Jaggery, Liquid Soaps & Bars, Moong Dal, Organic Masalas & Spices, Organic Salt,Sugar & Jaggery, Other Dals, Other Oils, Other Vegetables, Raw Rice, Root Vegetables, Sugar, Toor Dal,,,,,,,,,,,
Banana, Cooking Paste, Exotic Vegetables, Sooji & Rava,,,,,,,,,,,,,,,,,,,,,,,,
Aluminium Foil & Cling Wrap, Banana, Beans, Boiled Rice, Exotic Vegetables, Gourd & Cucumber, Raw Rice, Root Vegetables, Urad Dal,,,,,,,,,,,,,,,,,,,
Glucose, Marie & Milk Biscuits, Gourd & Cucumber, Other Vegetables, Root Vegetables, Urad Dal,,,,,,,,,,,,,,,,,,,,,,
Banana, Bread, Shaving Cream, Foam & Gels,,,,,,,,,,,,,,,,,,,,,,,,
Banana, Ghee, Health Drinks, Jaggery, Liquid Detergent, Moong Dal, Other Dals, Other Vegetables, Raw Peanuts, Root Vegetables, Sooji & Rava, Sunflower Oils, Toor Dal, Urad Dal, Vermicelli,,,,,,,,,,,,,
Diapers & Wipes, Shaving Cream, Foam & Gels,,,,,,,,,,,,,,,,,,,,,,,,,
Beans, Bread, Gourd & Cucumber, Namkeen, Root Vegetables, Sugar,,,,,,,,,,,,,,,,,,,,,,
Avalakki / Poha, Beans, Bread, Moong Dal, Other Vegetables, Root Vegetables, Urad Dal,,,,,,,,,,,,,,,,,,,,,
Beans, Bread, Raw Rice, Sugar,,,,,,,,,,,,,,,,,,,,,,,,
Banana, Beans, Boiled Rice, Gourd & Cucumber, Other Rice Products, Other Vegetables, Root Vegetables,,,,,,,,,,,,,,,,,,,,,
Banana, Beans, Gourd & Cucumber, Other Vegetables, Root Vegetables,,,,,,,,,,,,,,,,,,,,,,,
Banana, Beans, Exotic Vegetables, Other Vegetables, Root Vegetables, Sugar,,,,,,,,,,,,,,,,,,,,,,
Banana, Beans, Gourd & Cucumber, Organic Rice & Rice Products, Other Vegetables, Raw Rice, Root Vegetables, Sooji & Rava, Sunflower Oils,,,,,,,,,,,,,,,,,,,
Banana, Beans, Bread, Moong Dal, Root Vegetables, Sanitary Pads,,,,,,,,,,,,,,,,,,,,,,
Beans, Gourd & Cucumber, Other Oils, Other Vegetables, Root Vegetables,,,,,,,,,,,,,,,,,,,,,,,
Bread, Ground Coffee, Jaggery, Olive Oils, Other Vegetables, Raw Rice, Sooji & Rava, Sugar,,,,,,,,,,,,,,,,,,,,
Banana, Beans, Boiled Rice, Gourd & Cucumber, Instant Pastas, Other Dals, Other Vegetables, Root Vegetables, Toor Dal,,,,,,,,,,,,,,,,,,,
Banana, Beans, Root Vegetables,,,,,,,,,,,,,,,,,,,,,,,,,
Other Dals, Other Vegetables, Toor Dal, Urad Dal,,,,,,,,,,,,,,,,,,,,,,,,
Beans, Moong Dal, Organic Dals & Pulses, Other Vegetables, Ready Mix, Whole Spices,,,,,,,,,,,,,,,,,,,,,,
Banana, Exotic Vegetables, Gourd & Cucumber, Jaggery, Root Vegetables, Urad Dal,,,,,,,,,,,,,,,,,,,,,,
Face Wash, Health Drinks, Moong Dal, Other Dals, Toor Dal,,,,,,,,,,,,,,,,,,,,,,,
Boiled Rice, Other Rice Products, Raw Rice, Toor Dal, Urad Dal,,,,,,,,,,,,,,,,,,,,,,,
Banana, Beans, Exotic Vegetables, Liquid Soaps & Bars, Root Vegetables,,,,,,,,,,,,,,,,,,,,,,,
Banana, Beans, Gourd & Cucumber, Other Vegetables, Root Vegetables,,,,,,,,,,,,,,,,,,,,,,,
Beans, Bread, Butter & Cream, Face Wash, Liquid Soaps & Bars, Maida, Other Vegetables, Rice Flour, Root Vegetables,,,,,,,,,,,,,,,,,,,
Banana, Beans, Boiled Rice, Bread, Gourd & Cucumber, Other Vegetables, Root Vegetables, Whole Spices,,,,,,,,,,,,,,,,,,,,
Bread, Exotic Vegetables, Gourd & Cucumber, Raw Rice, Snacky Nuts, Tomato Ketchup, Toor Dal, Whole Spices,,,,,,,,,,,,,,,,,,,,
Banana, Beans, Other Vegetables, Root Vegetables,,,,,,,,,,,,,,,,,,,,,,,,
Banana, Beans, Cream Biscuits, Gourd & Cucumber, Health Drinks, Other Oils, Other Vegetables, Root Vegetables,,,,,,,,,,,,,,,,,,,,
Other Vegetables,,,,,,,,,,,,,,,,,,,,,,,,,,,
Banana, Beans, Bread, Gourd & Cucumber, Moong Dal, Other Dals, Root Vegetables, Toor Dal,,,,,,,,,,,,,,,,,,,,
Beans,,,,,,,,,,,,,,,,,,,,,,,,,,,
Banana, Bread, Liquid Soaps & Bars, Toor Dal, Yogurt & Lassi,,,,,,,,,,,,,,,,,,,,,,,
Beans, Bread, Other Vegetables,,,,,,,,,,,,,,,,,,,,,,,,,
Beans, Gourd & Cucumber, Other Dals, Raw Rice, Toor Dal,,,,,,,,,,,,,,,,,,,,,,,
Bread, Cream Biscuits, Ready Baking Mixes,,,,,,,,,,,,,,,,,,,,,,,,,
Banana, Root Vegetables,,,,,,,,,,,,,,,,,,,,,,,,,,
Banana, Other Vegetables, Rice Flour, Root Vegetables,,,,,,,,,,,,,,,,,,,,,,,,
Bread, Gourd & Cucumber, Health Drinks, Other Vegetables,,,,,,,,,,,,,,,,,,,,,,,,
Banana, Bread, Chips, Ice Creams & Desserts, Ready Mix, Sooji & Rava, Whole Spices,,,,,,,,,,,,,,,,,,,,,
Banana,,,,,,,,,,,,,,,,,,,,,,,,,,,
Beans, Ground Coffee, Toor Dal,,,,,,,,,,,,,,,,,,,,,,,,,
Avalakki / Poha, Boiled Rice, Moong Dal, Other Rice Products, Urad Dal, Whole Spices,,,,,,,,,,,,,,,,,,,,,,
Avalakki / Poha, Banana, Beans, Exotic Vegetables, Face Wash, Health Drinks, Jaggery, Moong Dal, Other Dals, Root Vegetables, Sugar, Vermicelli, Whole Spices,,,,,,,,,,,,,,,
Gourd & Cucumber, Root Vegetables,,,,,,,,,,,,,,,,,,,,,,,,,,
Diapers & Wipes, Ground Coffee, Other Flours, Raw Rice, Root Vegetables,,,,,,,,,,,,,,,,,,,,,,,
Beans, Gourd & Cucumber, Whole Spices,,,,,,,,,,,,,,,,,,,,,,,,,
Chilli & Soya Sauces, Gourd & Cucumber, Liquid Soaps & Bars,,,,,,,,,,,,,,,,,,,,,,,,,
Banana, Beans, Bread, Gourd & Cucumber, Organic Rice & Rice Products, Other Vegetables, Root Vegetables, Whole Spices,,,,,,,,,,,,,,,,,,,,
Beans, Gourd & Cucumber, Jaggery, Other Vegetables, Root Vegetables, Sugar,,,,,,,,,,,,,,,,,,,,,,
Banana, Beans, Gourd & Cucumber, Organic Masalas & Spices, Other Dals, Other Vegetables, Raw Rice, Root Vegetables,,,,,,,,,,,,,,,,,,,,
Banana, Beans, Other Vegetables, Root Vegetables,,,,,,,,,,,,,,,,,,,,,,,,
Banana, Beans, Gourd & Cucumber, Namkeen, Other Vegetables, Root Vegetables, Snacky Nuts, Toor Dal,,,,,,,,,,,,,,,,,,,,
Beans, Bread, Glucose, Marie & Milk Biscuits, Other Vegetables,,,,,,,,,,,,,,,,,,,,,,,
Moong Dal, Root Vegetables,,,,,,,,,,,,,,,,,,,,,,,,,,
Beans, Other Vegetables,,,,,,,,,,,,,,,,,,,,,,,,,,
Banana, Beans, Gourd & Cucumber, Other Dals, Raw Rice, Sugar, Urad Dal, Whole Spices,,,,,,,,,,,,,,,,,,,,
Banana, Bread, Raw Rice,,,,,,,,,,,,,,,,,,,,,,,,,
Bread, Ground Coffee, Raw Rice,,,,,,,,,,,,,,,,,,,,,,,,,
Beans, Root Vegetables,,,,,,,,,,,,,,,,,,,,,,,,,,
Moong Dal,,,,,,,,,,,,,,,,,,,,,,,,,,,
Beans, Exotic Vegetables, Maida, Other Vegetables, Raw Rice, Root Vegetables, Toor Dal, Urad Dal,,,,,,,,,,,,,,,,,,,,
Banana, Bread, Exotic Vegetables, Face Cream, Hair Oil, Liquid Soaps & Bars, Other Dals, Other Vegetables, Urad Dal,,,,,,,,,,,,,,,,,,,
Banana, Beans, Other Dals, Other Vegetables, Raw Rice, Root Vegetables, Sooji & Rava,,,,,,,,,,,,,,,,,,,,,
Beans, Cotton & Bandages, Curd, Gourd & Cucumber, Moong Dal, Other Dals, Other Vegetables, Ready Mix, Root Vegetables, Sooji & Rava,,,,,,,,,,,,,,,,,,
Beans, Cream Biscuits, Gourd & Cucumber, Health Drinks, Moong Dal, Other Dals, Other Vegetables, Root Vegetables, Shaving Blade & Razors, Sugar, Toor Dal, Vermicelli,,,,,,,,,,,,,,,,
Beans, Cream Biscuits, Gourd & Cucumber, Sugar,,,,,,,,,,,,,,,,,,,,,,,,
Other Dals,,,,,,,,,,,,,,,,,,,,,,,,,,,
Banana, Beans, Chinese Noodles, Glucose, Marie & Milk Biscuits, Ground Coffee, Moong Dal, Other Vegetables, Raw Rice, Whole Spices,,,,,,,,,,,,,,,,,,
Raw Rice, Toor Dal, Urad Dal,,,,,,,,,,,,,,,,,,,,,,,,,
Aluminium Foil & Cling Wrap, Beans, Bread, Chinese Noodles, Gourd & Cucumber, Maida, Other Vegetables, Root Vegetables,,,,,,,,,,,,,,,,,,,,
Banana, Beans, Moong Dal, Root Vegetables, Toor Dal,,,,,,,,,,,,,,,,,,,,,,,
Beans, Toor Dal,,,,,,,,,,,,,,,,,,,,,,,,,,
Banana, Ice Creams & Desserts, Sunflower Oils,,,,,,,,,,,,,,,,,,,,,,,,,
Banana, Bread, Moong Dal, Other Dals, Raw Rice, Shoe Polish, Snacky Nuts, Sooji & Rava, Toor Dal,,,,,,,,,,,,,,,,,,,
Sugar,,,,,,,,,,,,,,,,,,,,,,,,,,,
Avalakki / Poha, Health Drinks, Liquid Detergent, Other Dals, Root Vegetables,,,,,,,,,,,,,,,,,,,,,,,
Moong Dal,,,,,,,,,,,,,,,,,,,,,,,,,,,
Avalakki / Poha, Banana, Bread, Gourd & Cucumber, Other Vegetables, Raw Rice, Root Vegetables,,,,,,,,,,,,,,,,,,,,,
Basmati Rice, Besan, Bread, Cooking Paste, Ground Coffee, Moong Dal, Other Dals, Other Vegetables, Raw Rice, Sugar, Urad Dal,,,,,,,,,,,,,,,,,
Banana, Beans, Ghee, Gourd & Cucumber, Liquid Soaps & Bars, Other Dals, Raw Rice, Root Vegetables, Sugar, Urad Dal, Yogurt & Lassi,,,,,,,,,,,,,,,,,
Beans, Health Drinks, Other Vegetables, Root Vegetables,,,,,,,,,,,,,,,,,,,,,,,,
Bread, Glucose, Marie & Milk Biscuits, Moong Dal, Namkeen, Raw Rice, Ready Mix, Sugar, Sunflower Oils, Toor Dal, Whole Spices, Yogurt & Lassi,,,,,,,,,,,,,,,,
Beans, Root Vegetables,,,,,,,,,,,,,,,,,,,,,,,,,,
Basmati Rice, Beans, Boiled Rice, Gourd & Cucumber, Moong Dal, Root Vegetables, Sugar,,,,,,,,,,,,,,,,,,,,,
Namkeen, Snacky Nuts,,,,,,,,,,,,,,,,,,,,,,,,,,
Banana, Diapers & Wipes, Ground Coffee, Other Vegetables, Sunflower Oils,,,,,,,,,,,,,,,,,,,,,,,
Bread, Exotic Vegetables,,,,,,,,,,,,,,,,,,,,,,,,,,
Banana, Exotic Vegetables, Root Vegetables,,,,,,,,,,,,,,,,,,,,,,,,,
Banana, Beans, Boiled Rice, Gourd & Cucumber, Ice Creams & Desserts, Milk Drinks, Other Dals, Other Oils, Other Vegetables, Root Vegetables, Toor Dal, Urad Dal,,,,,,,,,,,,,,,,
Beans, Gourd & Cucumber, Root Vegetables, Sooji & Rava,,,,,,,,,,,,,,,,,,,,,,,,
Avalakki / Poha,,,,,,,,,,,,,,,,,,,,,,,,,,,
Avalakki / Poha, Boiled Rice, Bread, Other Rice Products, Toor Dal,,,,,,,,,,,,,,,,,,,,,,,
Banana, Beans, Cooking Paste, Gourd & Cucumber, Root Vegetables, Yogurt & Lassi,,,,,,,,,,,,,,,,,,,,,,
Bread,,,,,,,,,,,,,,,,,,,,,,,,,,,
Bread, Chinese Noodles, Moong Dal, Organic Flours, Organic Rice & Rice Products, Other Dals, Ready Mix, Sugar, Sunflower Oils,,,,,,,,,,,,,,,,,,,
Banana, Beans, Other Vegetables, Root Vegetables,,,,,,,,,,,,,,,,,,,,,,,,
Beans, Bread, Gourd & Cucumber, Root Vegetables, Toor Dal, Urad Dal,,,,,,,,,,,,,,,,,,,,,,
Banana, Beans, Cooking Paste, Gourd & Cucumber, Other Vegetables, Toor Dal,,,,,,,,,,,,,,,,,,,,,,
Banana, Beans, Bread, Liquid Soaps & Bars, Other Vegetables, Root Vegetables,,,,,,,,,,,,,,,,,,,,,,
Glucose, Marie & Milk Biscuits, Organic Dals & Pulses, Other Dals, Shaving Blade & Razors, Shaving Cream, Foam & Gels, Whole Spices,,,,,,,,,,,,,,,,,,,,
Bread, Moong Dal, Toor Dal,,,,,,,,,,,,,,,,,,,,,,,,,
Banana, Beans, Gourd & Cucumber, Namkeen, Other Insect Repellent, Other Oils, Other Vegetables, Root Vegetables,,,,,,,,,,,,,,,,,,,,
Banana, Namkeen, Whole Spices,,,,,,,,,,,,,,,,,,,,,,,,,
Banana, Diapers & Wipes, Ground Coffee, Pasta & Noodles,,,,,,,,,,,,,,,,,,,,,,,,
Avalakki / Poha, Organic Rice & Rice Products, Other Dals, Raw Rice, Sooji & Rava, Urad Dal,,,,,,,,,,,,,,,,,,,,,,
Other Dals, Rice Flour, Sooji & Rava, Toor Dal, Urad Dal,,,,,,,,,,,,,,,,,,,,,,,
Beans, Gourd & Cucumber, Ground Coffee, Moong Dal, Other Vegetables, Root Vegetables, Sooji & Rava, Urad Dal, Whole Spices,,,,,,,,,,,,,,,,,,,
Banana, Beans, Chinese Noodles, Diapers & Wipes, Sooji & Rava, Toor Dal,,,,,,,,,,,,,,,,,,,,,,
Banana, Beans, Gourd & Cucumber, Organic Masalas & Spices, Raw Rice, Root Vegetables, Sugar, Toor Dal,,,,,,,,,,,,,,,,,,,,
Beans, Cream Biscuits, Ghee, Other Dals, Raw Rice, Root Vegetables, Toor Dal, Wafers,,,,,,,,,,,,,,,,,,,,
Banana, Gourd & Cucumber, Root Vegetables,,,,,,,,,,,,,,,,,,,,,,,,,
Avalakki / Poha, Besan, Raw Peanuts, Sunflower Oils,,,,,,,,,,,,,,,,,,,,,,,,
Sooji & Rava, Sugar, Urad Dal,,,,,,,,,,,,,,,,,,,,,,,,,
Beans, Gourd & Cucumber, Other Dals, Other Vegetables, Root Vegetables,,,,,,,,,,,,,,,,,,,,,,,
Other Vegetables,,,,,,,,,,,,,,,,,,,,,,,,,,,
Bread, Organic Rice & Rice Products, Packaged Drinking Water, Whole Spices,,,,,,,,,,,,,,,,,,,,,,,,
Beans, Gourd & Cucumber, Other Vegetables, Toor Dal,,,,,,,,,,,,,,,,,,,,,,,,
Beans, Bread, Gourd & Cucumber, Moong Dal, Other Dals, Other Vegetables, Raw Rice, Root Vegetables, Toor Dal,,,,,,,,,,,,,,,,,,,
Beans, Bread, Ghee, Gourd & Cucumber, Organic Dals & Pulses, Organic Rice & Rice Products, Other Vegetables, Root Vegetables, Shampoo, Shaving Blade & Razors,,,,,,,,,,,,,,,,,,
Avalakki / Poha, Banana, Jaggery, Moong Dal, Other Dals, Rice Flour, Root Vegetables, Sooji & Rava, Sugar, Sunflower Oils, Toor Dal, Urad Dal, Vermicelli,,,,,,,,,,,,,,,
Banana, Beans, Gourd & Cucumber, Other Vegetables, Root Vegetables,,,,,,,,,,,,,,,,,,,,,,,
Banana, Beans, Gourd & Cucumber, Other Vegetables, Raw Rice, Root Vegetables,,,,,,,,,,,,,,,,,,,,,,
Banana, Beans, Bread, Root Vegetables,,,,,,,,,,,,,,,,,,,,,,,,
Beans, Cream Biscuits, Glucose, Marie & Milk Biscuits, Health Drinks, Other Vegetables, Root Vegetables, Sooji & Rava,,,,,,,,,,,,,,,,,,,,
Beans, Bread, Other Vegetables,,,,,,,,,,,,,,,,,,,,,,,,,
Bread, Other Vegetables, Root Vegetables,,,,,,,,,,,,,,,,,,,,,,,,,
Boiled Rice, Root Vegetables,,,,,,,,,,,,,,,,,,,,,,,,,,
Banana, Beans, Gourd & Cucumber, Other Dals, Other Vegetables, Sunflower Oils,,,,,,,,,,,,,,,,,,,,,,
Aluminium Foil & Cling Wrap, Mosquito Repellent, Other Insect Repellent,,,,,,,,,,,,,,,,,,,,,,,,,
Beans, Moong Dal, Organic Rice & Rice Products, Other Dals, Other Vegetables, Toor Dal,,,,,,,,,,,,,,,,,,,,,,
Moong Dal, Other Dals,,,,,,,,,,,,,,,,,,,,,,,,,,
Root Vegetables,,,,,,,,,,,,,,,,,,,,,,,,,,,
Beans, Boiled Rice, Bread, Curd,,,,,,,,,,,,,,,,,,,,,,,,
Banana, Boiled Rice, Cream Biscuits, Other Dals, Other Vegetables, Raw Rice, Root Vegetables, Sooji & Rava, Sunflower Oils, Urad Dal,,,,,,,,,,,,,,,,,,
Beans, Liquid Soaps & Bars, Namkeen, Other Rice Products,,,,,,,,,,,,,,,,,,,,,,,,
Avalakki / Poha, Namkeen, Other Vegetables, Root Vegetables,,,,,,,,,,,,,,,,,,,,,,,,
Boiled Rice, Moong Dal,,,,,,,,,,,,,,,,,,,,,,,,,,
Basmati Rice, Gourd & Cucumber, Sooji & Rava, Sugar, Whole Spices,,,,,,,,,,,,,,,,,,,,,,,
Bread, Other Vegetables,,,,,,,,,,,,,,,,,,,,,,,,,,
Ground Coffee, Other Vegetables,,,,,,,,,,,,,,,,,,,,,,,,,,
Chilli & Soya Sauces, Maida,,,,,,,,,,,,,,,,,,,,,,,,,,
Raw Rice, Sugar, Urad Dal,,,,,,,,,,,,,,,,,,,,,,,,,
Bread, Other Vegetables,,,,,,,,,,,,,,,,,,,,,,,,,,
Beans, Besan, Moong Dal, Other Dals, Root Vegetables,,,,,,,,,,,,,,,,,,,,,,,
Chips, Cream Biscuits, Energy Drinks, Other Dals, Other Rice Products, Raw Peanuts, Raw Rice, Sunflower Oils, Tomato Ketchup, Toor Dal, Urad Dal, Whole Spices,,,,,,,,,,,,,,,,
Beans, Cooking Paste, Gourd & Cucumber, Other Dals, Other Vegetables, Root Vegetables, Toor Dal,,,,,,,,,,,,,,,,,,,,,
Beans, Gourd & Cucumber, Namkeen, Organic Rice & Rice Products, Other Vegetables, Root Vegetables, Sooji & Rava, Whole Spices,,,,,,,,,,,,,,,,,,,,
Banana, Beans, Bread, Exotic Vegetables, Other Juices, Root Vegetables, Snacky Nuts,,,,,,,,,,,,,,,,,,,,,
Boiled Rice,,,,,,,,,,,,,,,,,,,,,,,,,,,
Banana, Beans, Rasagulla & Gulab Jamun, Root Vegetables, Yogurt & Lassi,,,,,,,,,,,,,,,,,,,,,,,
Banana, Beans, Besan, Gourd & Cucumber, Other Vegetables, Whole Spices,,,,,,,,,,,,,,,,,,,,,,
Bread, Curd, Namkeen, Other Dals, Other Vegetables, Sooji & Rava, Vinegar,,,,,,,,,,,,,,,,,,,,,
Beans, Chinese Noodles, Ground Coffee, Other Dals, Pasta & Noodles, Raw Rice, Toor Dal,,,,,,,,,,,,,,,,,,,,,
Bread, Ghee, Gourd & Cucumber, Honey, Other Insect Repellent, Other Soft Drinks, Root Vegetables, Sunflower Oils,,,,,,,,,,,,,,,,,,,,
Beans, Cotton & Bandages, Gourd & Cucumber, Liquid Soaps & Bars, Other Vegetables, Root Vegetables, Yogurt & Lassi,,,,,,,,,,,,,,,,,,,,,
Beans, Besan, Ice Creams & Desserts, Namkeen, Other Vegetables, Root Vegetables, Sooji & Rava,,,,,,,,,,,,,,,,,,,,,
Banana, Beans, Hair Oil, Other Rice Products, Urad Dal,,,,,,,,,,,,,,,,,,,,,,,
Beans, Bread, Gourd & Cucumber, Ice Creams & Desserts, Other Vegetables, Root Vegetables, Toor Dal,,,,,,,,,,,,,,,,,,,,,
Beans, Ghee, Gourd & Cucumber, Liquid Soaps & Bars, Namkeen, Organic Rice & Rice Products, Other Vegetables, Root Vegetables,,,,,,,,,,,,,,,,,,,,
Avalakki / Poha, Moong Dal, Other Dals,,,,,,,,,,,,,,,,,,,,,,,,,
Instant Noodles, Root Vegetables, Sugar,,,,,,,,,,,,,,,,,,,,,,,,,
Banana, Packaged Drinking Water,,,,,,,,,,,,,,,,,,,,,,,,,,
Veg & Fruit,,,,,,,,,,,,,,,,,,,,,,,,,,,
Beans, Gourd & Cucumber, Other Vegetables, Root Vegetables,,,,,,,,,,,,,,,,,,,,,,,,
Banana, Beans, Boiled Rice, Bread, Cream Biscuits, Face Wash, Gourd & Cucumber, Moong Dal, Oats, Other Dals, Other Vegetables, Raw Rice, Sugar, Toor Dal, Urad Dal,,,,,,,,,,,,,
Mosquito Repellent,,,,,,,,,,,,,,,,,,,,,,,,,,,
Banana, Beans, Health Drinks, Raw Rice, Root Vegetables, Sooji & Rava, Sugar, Urad Dal, Whole Spices,,,,,,,,,,,,,,,,,,,
Banana, Beans, Gourd & Cucumber, Namkeen, Other Dals, Other Vegetables, Snacky Nuts, Toor Dal,,,,,,,,,,,,,,,,,,,,
Banana, Boiled Rice, Ghee, Root Vegetables,,,,,,,,,,,,,,,,,,,,,,,,
Bread, Namkeen,,,,,,,,,,,,,,,,,,,,,,,,,,
Beans, Gourd & Cucumber, Other Dals, Other Vegetables,,,,,,,,,,,,,,,,,,,,,,,,
Beans, Bread, Exotic Vegetables, Ice Creams & Desserts, Other Vegetables, Sugar,,,,,,,,,,,,,,,,,,,,,,
Organic Dals & Pulses, Organic Masalas & Spices, Organic Rice & Rice Products, Other Dals, Powdered Spices, Raw Rice, Sooji & Rava, Sugar, Sunflower Oils,,,,,,,,,,,,,,,,,,,
Banana, Beans, Chips, Corn Snacks, Other Vegetables, Regular Pasta,,,,,,,,,,,,,,,,,,,,,,
Cream Biscuits, Glucose, Marie & Milk Biscuits, Namkeen, Other Dry Fruits,,,,,,,,,,,,,,,,,,,,,,,
Beans, Gourd & Cucumber, Other Dals, Other Vegetables, Root Vegetables,,,,,,,,,,,,,,,,,,,,,,,
Ice Creams & Desserts,,,,,,,,,,,,,,,,,,,,,,,,,,,
Beans, Ghee, Gourd & Cucumber, Health Drinks, Other Dals, Other Vegetables, Raw Rice, Root Vegetables, Sooji & Rava, Toor Dal, Urad Dal, Whole Spices,,,,,,,,,,,,,,,,
Beans, Other Vegetables,,,,,,,,,,,,,,,,,,,,,,,,,,
Beans, Ground Coffee, Other Vegetables, Root Vegetables,,,,,,,,,,,,,,,,,,,,,,,,
Beans, Cashews, Corn Snacks, Cream Biscuits, Gourd & Cucumber, Mango Juices, Moong Dal, Namkeen, Oats, Other Dry Fruits, Other Oils, Other Vegetables, Raw Rice, Rice Flour, Root Vegetables, Toor Dal,,,,,,,,,,,,
Health Drinks,,,,,,,,,,,,,,,,,,,,,,,,,,,
Banana, Beans, Moong Dal,,,,,,,,,,,,,,,,,,,,,,,,,
Beans, Chinese Noodles, Diapers & Wipes, Ground Coffee, Other Vegetables, Sugar, Sunflower Oils,,,,,,,,,,,,,,,,,,,,,
Corn Snacks, Mango Juices, Sugar,,,,,,,,,,,,,,,,,,,,,,,,,
Banana, Beans, Bread, Chips, Other Juices, Raw Rice, Root Vegetables, Snacky Nuts,,,,,,,,,,,,,,,,,,,,
Beans, Jaggery, Liquid Soaps & Bars, Mosquito Repellent, Organic Rice & Rice Products, Other Vegetables, Phenyles & Acids, Root Vegetables, Sugar, Whole Spices,,,,,,,,,,,,,,,,,,
Banana, Beans, Boiled Rice, Cream Biscuits, Other Dry Fruits, Root Vegetables, Shoe Polish,,,,,,,,,,,,,,,,,,,,,
Ice Creams & Desserts, Root Vegetables,,,,,,,,,,,,,,,,,,,,,,,,,,
Beans, Bread, Ground Coffee, Other Vegetables, Raw Rice, Urad Dal,,,,,,,,,,,,,,,,,,,,,,
Banana, Beans, Gourd & Cucumber, Other Vegetables, Root Vegetables,,,,,,,,,,,,,,,,,,,,,,,
Organic Masalas & Spices, Root Vegetables,,,,,,,,,,,,,,,,,,,,,,,,,,
Bread,,,,,,,,,,,,,,,,,,,,,,,,,,,
Cream Biscuits, Energy Drinks, Health Drinks, Namkeen, Other Rice Products, Sooji & Rava, Toor Dal, Urad Dal,,,,,,,,,,,,,,,,,,,,
Bread, Namkeen, Other Dry Fruits, Other Vegetables, Sooji & Rava, Whole Spices,,,,,,,,,,,,,,,,,,,,,,
Jaggery, Organic Flours, Toor Dal, Urad Dal,,,,,,,,,,,,,,,,,,,,,,,,
Banana, Beans, Gourd & Cucumber, Other Vegetables, Wafers,,,,,,,,,,,,,,,,,,,,,,,
Beans, Gourd & Cucumber, Other Vegetables, Root Vegetables,,,,,,,,,,,,,,,,,,,,,,,,
Banana, Bread, Chinese Noodles, Ghee, Maida, Organic Masalas & Spices, Organic Rice & Rice Products, Regular Pasta, Rice Flour, Root Vegetables, Toor Dal, Whole Spices,,,,,,,,,,,,,,,,
Gourd & Cucumber, Tomato Ketchup,,,,,,,,,,,,,,,,,,,,,,,,,,
Banana, Beans, Cashews, Gourd & Cucumber, Health Drinks, Raisins, Root Vegetables, Vermicelli,,,,,,,,,,,,,,,,,,,,
Gourd & Cucumber, Other Vegetables, Root Vegetables,,,,,,,,,,,,,,,,,,,,,,,,,
Banana, Beans,,,,,,,,,,,,,,,,,,,,,,,,,,
Bread, Health Drinks, Other Vegetables, Root Vegetables,,,,,,,,,,,,,,,,,,,,,,,,
