Glucose, Marie & Milk Biscuits, Organic F&V, Sunflower Oils,,,,,,,,,,,,,,,,,,,,,,,,
Raw Rice, Sugar,,,,,,,,,,,,,,,,,,,,,,,,,,
Banana, Butter & Cream, Gourd & Cucumber, Honey, Other Vegetables, Root Vegetables,,,,,,,,,,,,,,,,,,,,,,
Organic F&V, Other Vegetables,,,,,,,,,,,,,,,,,,,,,,,,,,
Beans, Other Vegetables, Root Vegetables, Toor Dal, Whole Spices,,,,,,,,,,,,,,,,,,,,,,,
Gourd & Cucumber, Other Vegetables, Root Vegetables,,,,,,,,,,,,,,,,,,,,,,,,,
Beans, Gourd & Cucumber, Other Sauces, Other Vegetables, Root Vegetables,,,,,,,,,,,,,,,,,,,,,,,
Beans, Gourd & Cucumber, Health Drinks, Oats, Other Vegetables, Root Vegetables,,,,,,,,,,,,,,,,,,,,,,
Banana, Beans, Cooking Paste, Exotic Vegetables, Gourd & Cucumber, Namkeen, Other Vegetables, Root Vegetables, Whole Spices,,,,,,,,,,,,,,,,,,,
Cooking Sauce,,,,,,,,,,,,,,,,,,,,,,,,,,,
Beans, Exotic Vegetables, Gourd & Cucumber, Other Vegetables, Root Vegetables,,,,,,,,,,,,,,,,,,,,,,,
Banana, Beans, Organic Dals & Pulses, Organic F&V, Other Vegetables, Root Vegetables,,,,,,,,,,,,,,,,,,,,,,
Organic F&V, Root Vegetables,,,,,,,,,,,,,,,,,,,,,,,,,,
Besan, Cooking Sauce, Maida, Moong Dal, Other Dals, Rice Flour, Sooji & Rava, Toor Dal, Whole Spices,,,,,,,,,,,,,,,,,,,
Chilli & Soya Sauces, Chips, Exotic Vegetables, Namkeen, Other Vegetables, Raw Rice, Root Vegetables,,,,,,,,,,,,,,,,,,,,,
Banana, Beans, Namkeen, Organic F&V, Other Insect Repellent, Other Vegetables, Raw Peanuts, Sunflower Oils,,,,,,,,,,,,,,,,,,,,
Bread, Ground Coffee, Other Vegetables, Sugar, Sunflower Oils,,,,,,,,,,,,,,,,,,,,,,,
Namkeen, Oats, Sooji & Rava, Sugar, Whole Spices,,,,,,,,,,,,,,,,,,,,,,,
Beans, Boiled Rice, Toor Dal, Whole Spices,,,,,,,,,,,,,,,,,,,,,,,,
Exotic Vegetables, Organic Dals & Pulses, Organic F&V, Organic Salt,Sugar & Jaggery,,,,,,,,,,,,,,,,,,,,,,,
Cashews, Ground Coffee, Other Dry Fruits, Tomato Ketchup,,,,,,,,,,,,,,,,,,,,,,,,
Other Vegetables,,,,,,,,,,,,,,,,,,,,,,,,,,,
Organic F&V,,,,,,,,,,,,,,,,,,,,,,,,,,,
Bread, Face Wash, Glucose, Marie & Milk Biscuits, Other Dals, Root Vegetables,,,,,,,,,,,,,,,,,,,,,,
Beans, Organic Rice & Rice Products, Root Vegetables,,,,,,,,,,,,,,,,,,,,,,,,,
Banana, Other Vegetables,,,,,,,,,,,,,,,,,,,,,,,,,,
Avalakki / Poha, Besan, Glucose, Marie & Milk Biscuits, Gourd & Cucumber, Moong Dal, Namkeen, Organic F&V, Other Dals, Other Vegetables, Raisins, Raw Peanuts, Root Vegetables, Sooji & Rava, Whole Spices,,,,,,,,,,,,,
Beans, Gourd & Cucumber,,,,,,,,,,,,,,,,,,,,,,,,,,
Banana, Gourd & Cucumber, Root Vegetables,,,,,,,,,,,,,,,,,,,,,,,,,
Sunflower Oils,,,,,,,,,,,,,,,,,,,,,,,,,,,
Body Wash, Boiled Rice, Liquid Soaps & Bars, Organic F&V, Organic Rice & Rice Products, Other Dals, Raw Rice, Sugar, Toor Dal, Urad Dal,,,,,,,,,,,,,,,,,,
Besan,,,,,,,,,,,,,,,,,,,,,,,,,,,
Banana, Basmati Rice, Bread, Exotic Vegetables, Gourd & Cucumber,,,,,,,,,,,,,,,,,,,,,,,
Chilli & Soya Sauces, Organic Masalas & Spices,,,,,,,,,,,,,,,,,,,,,,,,,,
Banana, Namkeen, Other Vegetables, Root Vegetables, Shaving Blade & Razors,,,,,,,,,,,,,,,,,,,,,,,
Cashews, Exotic Vegetables, Organic Dals & Pulses, Other Dry Fruits, Raisins,,,,,,,,,,,,,,,,,,,,,,,
Banana, Other Vegetables, Root Vegetables,,,,,,,,,,,,,,,,,,,,,,,,,
Exotic Vegetables, Pasta & Noodles, Veg & Fruit,,,,,,,,,,,,,,,,,,,,,,,,,
Beans, Jaggery, Namkeen, Other Flours, Other Vegetables, Pet Food, Powdered Spices, Snacky Nuts, Sooji & Rava, Sugar, Whole Spices,,,,,,,,,,,,,,,,,
Buttermilk, Yogurt & Lassi,,,,,,,,,,,,,,,,,,,,,,,,,,
Banana, Other Vegetables, Toor Dal,,,,,,,,,,,,,,,,,,,,,,,,,
Avalakki / Poha, Besan, Gourd & Cucumber, Instant Noodles, Jaggery, Liquid Detergent, Moong Dal, Organic F&V, Other Dals, Raw Peanuts, Sugar, Toor Dal, Urad Dal, Whole Spices,,,,,,,,,,,,,,
Beans, Gourd & Cucumber,,,,,,,,,,,,,,,,,,,,,,,,,,
Beans, Gourd & Cucumber, Moong Dal, Other Dals, Other Sauces, Other Vegetables, Raw Rice, Root Vegetables,,,,,,,,,,,,,,,,,,,,
Beans, Gourd & Cucumber, Moong Dal, Other Dals, Other Vegetables, Phenyles & Acids, Root Vegetables,,,,,,,,,,,,,,,,,,,,,
Antiseptics, Butter & Cream, Cakes, Curd, Exotic Vegetables, Honey, Root Vegetables, Sunflower Oils,,,,,,,,,,,,,,,,,,,,
Beans, Exotic Vegetables, Gourd & Cucumber, Organic F&V, Root Vegetables,,,,,,,,,,,,,,,,,,,,,,,
Exotic Vegetables, Raw Rice, Ready Baking Mixes, Root Vegetables, Sugar, Whole Spices,,,,,,,,,,,,,,,,,,,,,,
Basmati Rice, Bread, Other Oils,,,,,,,,,,,,,,,,,,,,,,,,,
Avalakki / Poha, Beans, Gourd & Cucumber, Mango Juices, Moong Dal, Namkeen, Organic F&V, Other Vegetables,,,,,,,,,,,,,,,,,,,,
Banana, Beans, Cakes, Gourd & Cucumber, Moong Dal, Root Vegetables, Whole Spices,,,,,,,,,,,,,,,,,,,,,
Beans, Organic Flours, Root Vegetables,,,,,,,,,,,,,,,,,,,,,,,,,
Banana, Beans, Ground Coffee, Health Drinks, Organic F&V, Other Vegetables, Raw Rice, Root Vegetables, Sooji & Rava,,,,,,,,,,,,,,,,,,,
Beans, Gourd & Cucumber, Other Vegetables,,,,,,,,,,,,,,,,,,,,,,,,,
Basmati Rice, Exotic Vegetables, Gourd & Cucumber, Moong Dal, Root Vegetables, Shampoo, Whole Spices,,,,,,,,,,,,,,,,,,,,,
Avalakki / Poha, Namkeen,,,,,,,,,,,,,,,,,,,,,,,,,,
Avalakki / Poha, Banana, Health Drinks, Organic Dals & Pulses, Organic F&V, Organic Rice & Rice Products, Organic Salt,Sugar & Jaggery, Other Sweets, Sooji & Rava,,,,,,,,,,,,,,,,,,
Beans, Exotic Vegetables, Gourd & Cucumber, Honey, Other Dry Fruits, Other Vegetables, Root Vegetables,,,,,,,,,,,,,,,,,,,,,
Beans, Instant Noodles,,,,,,,,,,,,,,,,,,,,,,,,,,
Ghee, Gourd & Cucumber, Organic F&V, Organic Rice & Rice Products, Other Vegetables, Root Vegetables,,,,,,,,,,,,,,,,,,,,,,
Besan, Ground Coffee, Moong Dal, Other Dals, Other Dry Fruits, Raisins, Raw Peanuts, Rice Flour, Toor Dal, Urad Dal, Whole Spices,,,,,,,,,,,,,,,,,
Banana, Beans, Namkeen, Organic F&V, Root Vegetables, Snacky Nuts, Whole Spices,,,,,,,,,,,,,,,,,,,,,
Banana, Beans, Exotic Vegetables, Organic F&V, Other Vegetables, Root Vegetables,,,,,,,,,,,,,,,,,,,,,,
Ghee, Gourd & Cucumber, Root Vegetables, Sugar, Whole Spices,,,,,,,,,,,,,,,,,,,,,,,
Banana, Beans, Cream Biscuits, Exotic Vegetables, Gourd & Cucumber, Hand Wash, Instant Pastas, Other Pooja Needs, Other Vegetables, Raw Peanuts, Raw Rice, Root Vegetables, Sugar, Urad Dal,,,,,,,,,,,,,,
Aluminium Foil & Cling Wrap, Banana, Honey, Namkeen, Raw Rice,,,,,,,,,,,,,,,,,,,,,,,
Butter & Cream, Exotic Vegetables, Raw Rice, Root Vegetables, Sugar, Toor Dal,,,,,,,,,,,,,,,,,,,,,,
Banana, Exotic Vegetables, Jaggery, Other Vegetables, Raisins, Root Vegetables,,,,,,,,,,,,,,,,,,,,,,
Beans, Gourd & Cucumber, Moong Dal, Namkeen, Organic F&V, Organic Rice & Rice Products, Other Dals, Other Vegetables, Toor Dal,,,,,,,,,,,,,,,,,,,
Boiled Rice, Ghee, Gourd & Cucumber, Jaggery, Maida, Moong Dal, Other Dals, Other Rice Products, Other Vegetables, Rice Flour, Sooji & Rava, Sugar, Toor Dal, Urad Dal, Whole Spices,,,,,,,,,,,,,
Beans, Organic F&V, Other Vegetables, Raw Rice, Root Vegetables,,,,,,,,,,,,,,,,,,,,,,,
Beans, Exotic Vegetables, Namkeen, Root Vegetables,,,,,,,,,,,,,,,,,,,,,,,,
Beans, Besan, Chinese Noodles, Cooking Paste, Cream Biscuits, Energy Drinks, Glucose, Marie & Milk Biscuits, Jaggery, Moong Dal, Namkeen, Other Dals, Other Dry Fruits, Packaged Drinking Water, Raisins, Raw Rice, Regular Pasta, Root Vegetables, Sunflower Oils, Toor Dal, Wafers, Whole Spices,,,,,,
Beans, Bread, Root Vegetables,,,,,,,,,,,,,,,,,,,,,,,,,
Bread, Organic Rice & Rice Products, Other Dals, Raw Rice,,,,,,,,,,,,,,,,,,,,,,,,
Banana, Organic F&V, Other Vegetables, Root Vegetables, Whole Spices,,,,,,,,,,,,,,,,,,,,,,,
Avalakki / Poha, Beans, Chips, Gourd & Cucumber, Root Vegetables, Sugar,,,,,,,,,,,,,,,,,,,,,,
Beans, Gourd & Cucumber, Organic F&V, Other Dals, Other Vegetables, Raw Peanuts, Root Vegetables, Sooji & Rava, Sunflower Oils,,,,,,,,,,,,,,,,,,,
Cashews, Moong Dal, Namkeen, Other Dals, Raw Rice, Sunflower Oils,,,,,,,,,,,,,,,,,,,,,,
Banana, Basmati Rice, Beans, Cashews, Other Vegetables, Root Vegetables,,,,,,,,,,,,,,,,,,,,,,
Banana, Basmati Rice, Beans, Gourd & Cucumber, Other Dals, Other Vegetables,,,,,,,,,,,,,,,,,,,,,,
Beans, Gourd & Cucumber, Organic F&V, Other Vegetables,,,,,,,,,,,,,,,,,,,,,,,,
Banana, Beans, Gourd & Cucumber, Other Rice Products, Other Vegetables, Raw Rice, Root Vegetables,,,,,,,,,,,,,,,,,,,,,
Instant Noodles, Sooji & Rava,,,,,,,,,,,,,,,,,,,,,,,,,,
Beans, Bread, Gourd & Cucumber, Other Dals, Other Vegetables,,,,,,,,,,,,,,,,,,,,,,,
Beans, Gourd & Cucumber, Other Vegetables,,,,,,,,,,,,,,,,,,,,,,,,,
Gourd & Cucumber, Other Vegetables,,,,,,,,,,,,,,,,,,,,,,,,,,
Banana, Gourd & Cucumber, Other Dals, Toor Dal, Whole Spices,,,,,,,,,,,,,,,,,,,,,,,
Other Vegetables, Root Vegetables,,,,,,,,,,,,,,,,,,,,,,,,,,
Avalakki / Poha, Beans, Besan, Gourd & Cucumber, Moong Dal, Other Dals, Other Vegetables, Raw Rice, Root Vegetables, Sooji & Rava, Sugar, Urad Dal, Whole Spices,,,,,,,,,,,,,,,
Beans, Organic F&V,,,,,,,,,,,,,,,,,,,,,,,,,,
Diapers & Wipes, Sugar,,,,,,,,,,,,,,,,,,,,,,,,,,
Avalakki / Poha, Banana, Beans, Root Vegetables, Sunflower Oils, Wafers,,,,,,,,,,,,,,,,,,,,,,
Beans, Bread, Exotic Vegetables, Gourd & Cucumber, Ready Baking Mixes, Root Vegetables,,,,,,,,,,,,,,,,,,,,,,
Banana, Beans, Gourd & Cucumber, Other Spreads, Root Vegetables,,,,,,,,,,,,,,,,,,,,,,,
Banana, Gourd & Cucumber, Root Vegetables,,,,,,,,,,,,,,,,,,,,,,,,,
Ghee, Jaggery, Maida, Other Dals, Toor Dal,,,,,,,,,,,,,,,,,,,,,,,
Banana, Liquid Soaps & Bars, Phenyles & Acids, Raisins,,,,,,,,,,,,,,,,,,,,,,,,
Avalakki / Poha, Banana, Root Vegetables, Whole Spices,,,,,,,,,,,,,,,,,,,,,,,,
Beans, Glucose, Marie & Milk Biscuits, Gourd & Cucumber, Other Vegetables, Root Vegetables,,,,,,,,,,,,,,,,,,,,,,
Basmati Rice, Organic Masalas & Spices, Other Vegetables, Root Vegetables,,,,,,,,,,,,,,,,,,,,,,,,
Beans, Organic F&V, Other Vegetables, Root Vegetables, Toor Dal,,,,,,,,,,,,,,,,,,,,,,,
Banana,,,,,,,,,,,,,,,,,,,,,,,,,,,
Other Dals,,,,,,,,,,,,,,,,,,,,,,,,,,,
Avalakki / Poha, Banana, Besan, Exotic Vegetables, Organic F&V, Other Dals, Other Vegetables, Regular Pasta, Root Vegetables, Sooji & Rava,,,,,,,,,,,,,,,,,,
Organic F&V,,,,,,,,,,,,,,,,,,,,,,,,,,,
Gourd & Cucumber, Other Vegetables, Root Vegetables, Sooji & Rava, Whole Spices,,,,,,,,,,,,,,,,,,,,,,,
Other Dals,,,,,,,,,,,,,,,,,,,,,,,,,,,
Beans, Diapers & Wipes, Exotic Vegetables, Ground Coffee, Organic F&V, Other Vegetables, Raw Peanuts,,,,,,,,,,,,,,,,,,,,,
Bread, Oats, Sugar,,,,,,,,,,,,,,,,,,,,,,,,,
Glucose, Marie & Milk Biscuits, Root Vegetables,,,,,,,,,,,,,,,,,,,,,,,,,
Exotic Vegetables, Root Vegetables,,,,,,,,,,,,,,,,,,,,,,,,,,
Banana, Organic F&V, Root Vegetables, Sunflower Oils,,,,,,,,,,,,,,,,,,,,,,,,
Grooming, Honey, Other Vegetables, Whole Spices,,,,,,,,,,,,,,,,,,,,,,,,
Beans, Organic F&V, Organic Flours, Organic Masalas & Spices, Organic Salt,Sugar & Jaggery,,,,,,,,,,,,,,,,,,,,,,
Cooking Sauce, Tomato Ketchup,,,,,,,,,,,,,,,,,,,,,,,,,,
Banana, Beans, Bread, Glucose, Marie & Milk Biscuits, Gourd & Cucumber, Organic F&V, Root Vegetables, Sooji & Rava, Sugar, Whole Spices,,,,,,,,,,,,,,,,,
Banana, Beans, Health Drinks, Maida, Other Dals, Raw Rice, Root Vegetables, Sugar, Toor Dal, Urad Dal,,,,,,,,,,,,,,,,,,
Cream Biscuits, Glucose, Marie & Milk Biscuits, Organic F&V, Organic Flours, Organic Salt,Sugar & Jaggery, Other Dry Fruits, Other Oils, Whole Grains,,,,,,,,,,,,,,,,,,
Exotic Vegetables, Organic F&V, Raw Rice, Root Vegetables,,,,,,,,,,,,,,,,,,,,,,,,
Exotic Vegetables, Organic Dals & Pulses, Organic F&V, Organic Masalas & Spices, Other Vegetables, Rice Flour, Root Vegetables, Sooji & Rava, Sugar, Toor Dal, Whole Spices,,,,,,,,,,,,,,,,,
Moong Dal, Namkeen, Other Insect Repellent, Other Vegetables, Sunflower Oils, Toor Dal,,,,,,,,,,,,,,,,,,,,,,
Bread, Curd, Other Oils, Sugar,,,,,,,,,,,,,,,,,,,,,,,,
Banana, Beans, Cakes, Namkeen, Root Vegetables, Snacky Nuts, Whole Spices,,,,,,,,,,,,,,,,,,,,,
Banana, Curd, Gourd & Cucumber, Mosquito Repellent, Other Vegetables, Root Vegetables, Snacky Nuts,,,,,,,,,,,,,,,,,,,,,
Beans, Exotic Vegetables, Gourd & Cucumber, Organic F&V, Raw Peanuts, Ready Mix, Root Vegetables, Whole Spices,,,,,,,,,,,,,,,,,,,,
Banana, Beans, Gourd & Cucumber, Other Vegetables, Root Vegetables,,,,,,,,,,,,,,,,,,,,,,,
Ground Coffee, Moong Dal, Urad Dal,,,,,,,,,,,,,,,,,,,,,,,,,
Raw Rice,,,,,,,,,,,,,,,,,,,,,,,,,,,
Gourd & Cucumber,,,,,,,,,,,,,,,,,,,,,,,,,,,
Banana, Other Vegetables,,,,,,,,,,,,,,,,,,,,,,,,,,
Beans, Gourd & Cucumber, Other Vegetables,,,,,,,,,,,,,,,,,,,,,,,,,
Beans, Gourd & Cucumber, Other Vegetables, Root Vegetables,,,,,,,,,,,,,,,,,,,,,,,,
Avalakki / Poha, Bread, Cashews, Exotic Vegetables, Ghee, Glucose, Marie & Milk Biscuits, Gourd & Cucumber, Health Drinks, Honey, Organic F&V, Root Vegetables, Sooji & Rava, Sunflower Oils, Vermicelli,,,,,,,,,,,,,
Banana, Cream Biscuits, Raw Rice,,,,,,,,,,,,,,,,,,,,,,,,,
Aluminium Foil & Cling Wrap, Beans, Bread, Cashews, Gourd & Cucumber, Organic F&V, Organic Rice & Rice Products, Other Vegetables, Toffee & Candy,,,,,,,,,,,,,,,,,,,
Banana, Namkeen, Other Vegetables, Root Vegetables,,,,,,,,,,,,,,,,,,,,,,,,
Banana, Gourd & Cucumber, Namkeen, Organic F&V, Other Dals, Other Vegetables, Root Vegetables, Whole Spices,,,,,,,,,,,,,,,,,,,,
Banana, Beans, Besan, Cream Biscuits, Gourd & Cucumber, Moong Dal, Other Vegetables, Root Vegetables, Sugar, Urad Dal,,,,,,,,,,,,,,,,,,
Namkeen, Rasagulla & Gulab Jamun,,,,,,,,,,,,,,,,,,,,,,,,,,
Banana, Bread, Exotic Vegetables, Gourd & Cucumber, Milk, Sanitary Pads,,,,,,,,,,,,,,,,,,,,,,
Beans, Gourd & Cucumber, Health Drinks, Liquid Soaps & Bars, Mosquito Repellent, Other Vegetables, Root Vegetables, Sooji & Rava,,,,,,,,,,,,,,,,,,,,
Avalakki / Poha, Ground Coffee, Namkeen, Other Rice Products, Raw Rice, Rice Flour, Snacky Nuts, Sugar, Sunflower Oils, Toor Dal,,,,,,,,,,,,,,,,,,
Beans, Other Vegetables,,,,,,,,,,,,,,,,,,,,,,,,,,
Aluminium Foil & Cling Wrap, Banana, Exotic Vegetables, Health Drinks, Other Dals, Root Vegetables,,,,,,,,,,,,,,,,,,,,,,
Banana, Beans, Bread, Gourd & Cucumber, Namkeen, Other Dals, Other Vegetables, Raw Rice, Root Vegetables, Sooji & Rava,,,,,,,,,,,,,,,,,,
Banana, Mango Juices,,,,,,,,,,,,,,,,,,,,,,,,,,
Avalakki / Poha, Besan, Boiled Rice, Jaggery, Powdered Spices, Sooji & Rava, Urad Dal, Whole Spices,,,,,,,,,,,,,,,,,,,,
Beans, Organic Rice & Rice Products,,,,,,,,,,,,,,,,,,,,,,,,,,
Beans, Gourd & Cucumber, Other Vegetables,,,,,,,,,,,,,,,,,,,,,,,,,
Energy Drinks, Health Drinks,,,,,,,,,,,,,,,,,,,,,,,,,,
Gourd & Cucumber, Other Dals, Raw Peanuts, Toor Dal,,,,,,,,,,,,,,,,,,,,,,,,
Beans, Gourd & Cucumber, Other Dals, Other Dry Fruits, Other Vegetables, Root Vegetables, Sugar,,,,,,,,,,,,,,,,,,,,,
Exotic Vegetables, Raw Peanuts,,,,,,,,,,,,,,,,,,,,,,,,,,
Beans, Organic F&V, Other Dals, Other Vegetables, Root Vegetables, Sugar, Toor Dal,,,,,,,,,,,,,,,,,,,,,
Beans, Besan, Gourd & Cucumber, Instant Pastas, Mango Juices, Raw Peanuts, Root Vegetables, Sugar, Sunflower Oils,,,,,,,,,,,,,,,,,,,
Beans, Cooking Sauce, Glucose, Marie & Milk Biscuits, Other Dals,,,,,,,,,,,,,,,,,,,,,,,
Organic Dals & Pulses, Organic F&V, Other Dals, Raw Rice, Sugar,,,,,,,,,,,,,,,,,,,,,,,
Organic Masalas & Spices, Rice Flour, Urad Dal, Washing Bars,,,,,,,,,,,,,,,,,,,,,,,,
Beans, Bread, Gourd & Cucumber, Moong Dal, Oats, Other Vegetables, Root Vegetables, Sooji & Rava,,,,,,,,,,,,,,,,,,,,
Gourd & Cucumber, Hair Oil, Organic F&V,,,,,,,,,,,,,,,,,,,,,,,,,
Beans, Gourd & Cucumber, Organic Rice & Rice Products, Other Dals, Other Vegetables,,,,,,,,,,,,,,,,,,,,,,,
Cooking Sauce, Moong Dal, Other Dals, Raw Rice, Toor Dal,,,,,,,,,,,,,,,,,,,,,,,
Beans, Moong Dal, Other Vegetables, Regular Pasta, Root Vegetables, Sooji & Rava, Sunflower Oils, Whole Spices,,,,,,,,,,,,,,,,,,,,
Banana, Beans, Jaggery, Moong Dal, Organic F&V, Other Dals, Other Vegetables, Root Vegetables, Sugar,,,,,,,,,,,,,,,,,,,
Avalakki / Poha, Organic F&V, Organic Rice & Rice Products, Other Dals, Other Dry Fruits, Other Vegetables, Raw Rice, Root Vegetables,,,,,,,,,,,,,,,,,,,,
Banana, Honey, Moong Dal,,,,,,,,,,,,,,,,,,,,,,,,,
Beans, Exotic Vegetables, Namkeen, Organic F&V, Organic Rice & Rice Products, Other Dals, Urad Dal,,,,,,,,,,,,,,,,,,,,,
Beans, Diapers & Wipes, Organic F&V,,,,,,,,,,,,,,,,,,,,,,,,,
Chips, Exotic Vegetables, Gourd & Cucumber, Raw Rice, Sanitary Pads, Sugar, Toothpaste, Urad Dal,,,,,,,,,,,,,,,,,,,,
Gourd & Cucumber, Root Vegetables,,,,,,,,,,,,,,,,,,,,,,,,,,
Beans, Cashews, Gourd & Cucumber, Organic Dals & Pulses, Other Dals, Other Dry Fruits, Other Vegetables,,,,,,,,,,,,,,,,,,,,,
Sunflower Oils, Whole Spices,,,,,,,,,,,,,,,,,,,,,,,,,,
Beans, Green Tea, Other Juices, Other Vegetables, Root Vegetables, Toor Dal,,,,,,,,,,,,,,,,,,,,,,
Organic F&V, Root Vegetables,,,,,,,,,,,,,,,,,,,,,,,,,,
Bread, Curd, Gourd & Cucumber, Namkeen, Raw Rice,,,,,,,,,,,,,,,,,,,,,,,
Beans, Besan, Gourd & Cucumber, Other Dals, Other Vegetables, Urad Dal,,,,,,,,,,,,,,,,,,,,,,
Beans, Cashews, Other Rice Products, Sooji & Rava, Toor Dal, Urad Dal,,,,,,,,,,,,,,,,,,,,,,
Gourd & Cucumber, Other Vegetables,,,,,,,,,,,,,,,,,,,,,,,,,,
Gourd & Cucumber, Organic F&V, Organic Masalas & Spices, Other Vegetables, Raisins, Root Vegetables, Toor Dal, Urad Dal,,,,,,,,,,,,,,,,,,,,
Avalakki / Poha, Health Drinks, Namkeen, Raw Peanuts, Regular Pasta, Sooji & Rava, Sugar, Whole Spices,,,,,,,,,,,,,,,,,,,,
Avalakki / Poha, Besan, Cashews, Chilli & Soya Sauces, Jams & Sauces, Maida, Moong Dal, Other Dals, Other Flours, Other Rice Products, Other Sauces, Raw Peanuts, Raw Rice, Ready Mix, Sooji & Rava, Sugar, Sunflower Oils, Toothpaste, Whole Spices,,,,,,,,,
Avalakki / Poha, Exotic Vegetables, Ground Coffee, Other Dry Fruits, Phenyles & Acids, Raw Rice, Sooji & Rava, Sugar, Toor Dal, Whole Spices,,,,,,,,,,,,,,,,,,
Root Vegetables,,,,,,,,,,,,,,,,,,,,,,,,,,,
Cooking Sauce, Curd, Ghee, Gourd & Cucumber, Other Dals, Root Vegetables, Toor Dal, Whole Spices,,,,,,,,,,,,,,,,,,,,
Aluminium Foil & Cling Wrap, Banana, Besan, Moong Dal, Other Dals, Raw Rice, Whole Spices,,,,,,,,,,,,,,,,,,,,,
Beans, Jaggery, Other Vegetables, Root Vegetables, Sooji & Rava, Whole Spices,,,,,,,,,,,,,,,,,,,,,,
Beans, Gourd & Cucumber,,,,,,,,,,,,,,,,,,,,,,,,,,
Beans, Gourd & Cucumber, Organic F&V, Other Vegetables, Root Vegetables, Tomato Ketchup,,,,,,,,,,,,,,,,,,,,,,
Beans, Gourd & Cucumber, Other Vegetables, Raw Rice, Root Vegetables, Sunflower Oils,,,,,,,,,,,,,,,,,,,,,,
Beans, Other Flours, Root Vegetables, Sooji & Rava, Sugar, Sunflower Oils, Toothpaste, Whole Spices,,,,,,,,,,,,,,,,,,,,
Banana, Glucose, Marie & Milk Biscuits, Moong Dal, Organic F&V, Other Dals, Other Vegetables, Raw Rice, Root Vegetables,,,,,,,,,,,,,,,,,,,
Beans, Gourd & Cucumber, Other Vegetables,,,,,,,,,,,,,,,,,,,,,,,,,
Health Drinks, Organic F&V, Organic Salt,Sugar & Jaggery,,,,,,,,,,,,,,,,,,,,,,,,
Banana, Glucose, Marie & Milk Biscuits, Whole Spices,,,,,,,,,,,,,,,,,,,,,,,,
Cakes, Namkeen, Other Dry Fruits, Raisins, Snacky Nuts,,,,,,,,,,,,,,,,,,,,,,,
Namkeen, Shaving Blade & Razors, Vermicelli, Whole Spices,,,,,,,,,,,,,,,,,,,,,,,,
Banana, Bread, Exotic Vegetables, Gourd & Cucumber, Milk, Other Vegetables, Root Vegetables, Toor Dal,,,,,,,,,,,,,,,,,,,,
Beans, Cashews, Raw Peanuts, Root Vegetables,,,,,,,,,,,,,,,,,,,,,,,,
Beans, Instant Noodles, Instant Pastas, Root Vegetables,,,,,,,,,,,,,,,,,,,,,,,,
Glucose, Marie & Milk Biscuits, Other Oils, Root Vegetables, Sugar,,,,,,,,,,,,,,,,,,,,,,,
Banana, Beans, Organic F&V, Organic Masalas & Spices, Other Vegetables,,,,,,,,,,,,,,,,,,,,,,,
Banana, Gourd & Cucumber, Other Vegetables,,,,,,,,,,,,,,,,,,,,,,,,,
Gourd & Cucumber, Other Vegetables, Sugar,,,,,,,,,,,,,,,,,,,,,,,,,
Ghee, Rice Flour, Sooji & Rava, Sunflower Oils, Urad Dal,,,,,,,,,,,,,,,,,,,,,,,
Organic F&V, Other Vegetables, Root Vegetables,,,,,,,,,,,,,,,,,,,,,,,,,
Banana, Beans, Bread, Gourd & Cucumber, Namkeen, Organic Rice & Rice Products, Other Dals, Other Vegetables, Snacky Nuts,,,,,,,,,,,,,,,,,,,
Beans, Cotton & Bandages, Gourd & Cucumber, Moong Dal, Other Dals, Raw Rice, Sooji & Rava,,,,,,,,,,,,,,,,,,,,,
Beans,,,,,,,,,,,,,,,,,,,,,,,,,,,
Cooking Sauce, Exotic Vegetables, Organic F&V, Other Dals, Sooji & Rava, Sugar, Urad Dal, Whole Spices,,,,,,,,,,,,,,,,,,,,
Beans, Health Drinks, Other Dals, Other Vegetables, Root Vegetables,,,,,,,,,,,,,,,,,,,,,,,
Avalakki / Poha, Ground Coffee, Moong Dal, Mosquito Repellent, Other Rice Products, Sooji & Rava, Sunflower Oils,,,,,,,,,,,,,,,,,,,,,
Banana, Organic Dals & Pulses, Organic Rice & Rice Products, Other Vegetables, Raw Peanuts, Snacky Nuts,,,,,,,,,,,,,,,,,,,,,,
Avalakki / Poha, Banana, Bread, Gourd & Cucumber, Namkeen, Raisins, Snacky Nuts, Sooji & Rava, Urad Dal,,,,,,,,,,,,,,,,,,,
Beans, Gourd & Cucumber, Namkeen, Other Vegetables, Root Vegetables,,,,,,,,,,,,,,,,,,,,,,,
Exotic Vegetables, Moong Dal, Other Dry Fruits, Other Rice Products, Root Vegetables,,,,,,,,,,,,,,,,,,,,,,,
Banana, Exotic Vegetables, Gourd & Cucumber, Moong Dal, Root Vegetables,,,,,,,,,,,,,,,,,,,,,,,
Banana, Glucose, Marie & Milk Biscuits, Gourd & Cucumber, Other Flours, Other Vegetables,,,,,,,,,,,,,,,,,,,,,,
Liquid Soaps & Bars, Other Vegetables, Root Vegetables,,,,,,,,,,,,,,,,,,,,,,,,,
Banana, Beans, Gourd & Cucumber, Other Dals, Other Vegetables, Sugar,,,,,,,,,,,,,,,,,,,,,,
Beans, Jaggery, Maida, Other Rice Products, Other Sweets, Root Vegetables, Sooji & Rava, Sugar, Toor Dal,,,,,,,,,,,,,,,,,,,
Exotic Vegetables,,,,,,,,,,,,,,,,,,,,,,,,,,,
Banana, Beans, Gourd & Cucumber, Root Vegetables, Sooji & Rava, Sugar,,,,,,,,,,,,,,,,,,,,,,
Other Insect Repellent, Other Vegetables, Regular Pasta,,,,,,,,,,,,,,,,,,,,,,,,,
Banana, Basmati Rice, Beans, Organic Dals & Pulses, Organic F&V, Other Rice Products, Snacky Nuts,,,,,,,,,,,,,,,,,,,,,
Banana, Beans, Cream Biscuits, Mango Juices, Namkeen, Organic F&V, Other Oils, Toor Dal, Urad Dal,,,,,,,,,,,,,,,,,,,
Bread, Cakes, Namkeen, Organic F&V, Other Vegetables, Sooji & Rava,,,,,,,,,,,,,,,,,,,,,,
Beans, Bread, Gourd & Cucumber, Organic F&V, Other Dals, Other Vegetables,,,,,,,,,,,,,,,,,,,,,,
Gourd & Cucumber, Ground Coffee, Other Vegetables, Root Vegetables, Whole Grains,,,,,,,,,,,,,,,,,,,,,,,
Beans, Besan, Gourd & Cucumber, Honey, Instant Pastas, Organic Rice & Rice Products, Other Vegetables, Regular Pasta, Toor Dal,,,,,,,,,,,,,,,,,,,
Beans, Organic F&V, Other Vegetables, Sugar, Toor Dal,,,,,,,,,,,,,,,,,,,,,,,
Banana, Mens Deo, Namkeen, Raisins,,,,,,,,,,,,,,,,,,,,,,,,
Beans, Gourd & Cucumber, Other Vegetables, Root Vegetables, Sugar, Toor Dal, Urad Dal, Whole Spices,,,,,,,,,,,,,,,,,,,,
Basmati Rice, Cooking Paste, Cooking Sauce, Maida, Other Dals, Other Sauces, Pre & Post Wash Care, Ready Baking Mixes, Ready Mix, Regular Pasta, Sooji & Rava, Sugar, Sunflower Oils, Toor Dal, Toothpaste, Urad Dal, Veg & Fruit,,,,,,,,,,,
Avalakki / Poha, Banana, Glucose, Marie & Milk Biscuits, Instant Noodles, Namkeen, Other Vegetables,,,,,,,,,,,,,,,,,,,,,
Banana, Gourd & Cucumber, Maida, Other Vegetables,,,,,,,,,,,,,,,,,,,,,,,,
Basmati Rice, Health Drinks, Maida, Organic Dals & Pulses, Organic F&V, Other Dals, Other Vegetables, Root Vegetables,,,,,,,,,,,,,,,,,,,,
Beans, Chips, Healthy Snacks, Namkeen, Root Vegetables,,,,,,,,,,,,,,,,,,,,,,,
Organic F&V,,,,,,,,,,,,,,,,,,,,,,,,,,,
Beans, Chilli & Soya Sauces, Other Vegetables,,,,,,,,,,,,,,,,,,,,,,,,,
Shaving Blade & Razors,,,,,,,,,,,,,,,,,,,,,,,,,,,
Liquid Detergent,,,,,,,,,,,,,,,,,,,,,,,,,,,
Bread, Exotic Vegetables, Frozen Veg Food, Glucose, Marie & Milk Biscuits,,,,,,,,,,,,,,,,,,,,,,,
Cooking Paste,,,,,,,,,,,,,,,,,,,,,,,,,,,
Basmati Rice, Exotic Vegetables, Liquid Soaps & Bars, Maida, Mosquito Repellent, Organic Masalas & Spices, Organic Salt,Sugar & Jaggery, Other Dals, Other Vegetables, Ready Mix, Sooji & Rava, Toilet Cleaners, Urad Dal,,,,,,,,,,,,,,
Banana, Bread, Exotic Vegetables, Gourd & Cucumber, Other Dals, Other Vegetables, Root Vegetables, Sanitary Pads,,,,,,,,,,,,,,,,,,,,
Basmati Rice, Exotic Vegetables, Glucose, Marie & Milk Biscuits, Instant Noodles, Other Vegetables, Root Vegetables, Sugar, Whole Spices,,,,,,,,,,,,,,,,,,,
Other Vegetables, Phenyles & Acids, Regular Pasta,,,,,,,,,,,,,,,,,,,,,,,,,
Butter & Cream, Cooking Sauce, Ghee, Organic F&V,,,,,,,,,,,,,,,,,,,,,,,,
Beans, Organic F&V, Other Juices, Other Vegetables, Pasta & Noodles,,,,,,,,,,,,,,,,,,,,,,,
Beans, Gourd & Cucumber, Organic Flours, Other Vegetables, Root Vegetables, Shampoo, Whole Spices,,,,,,,,,,,,,,,,,,,,,
Exotic Vegetables, Mango Juices,,,,,,,,,,,,,,,,,,,,,,,,,,
Banana, Beans, Gourd & Cucumber, Moong Dal, Other Dals, Root Vegetables, Whole Spices,,,,,,,,,,,,,,,,,,,,,
Banana, Beans, Bread, Gourd & Cucumber, Other Vegetables, Ready Baking Mixes, Root Vegetables,,,,,,,,,,,,,,,,,,,,,
Other Vegetables, Sugar,,,,,,,,,,,,,,,,,,,,,,,,,,
Banana, Gourd & Cucumber, Root Vegetables,,,,,,,,,,,,,,,,,,,,,,,,,
Avalakki / Poha, Beans, Gourd & Cucumber, Other Dals, Other Vegetables, Raw Rice, Root Vegetables,,,,,,,,,,,,,,,,,,,,,
Glucose, Marie & Milk Biscuits, Gourd & Cucumber, Other Vegetables, Root Vegetables,,,,,,,,,,,,,,,,,,,,,,,
Other Dals, Other Vegetables, Root Vegetables, Sugar,,,,,,,,,,,,,,,,,,,,,,,,
Beans, Gourd & Cucumber, Other Vegetables,,,,,,,,,,,,,,,,,,,,,,,,,
Besan, Exotic Vegetables, Gourd & Cucumber, Moong Dal, Other Dals, Other Vegetables, Raw Peanuts, Root Vegetables, Toor Dal, Urad Dal,,,,,,,,,,,,,,,,,,
Organic F&V,,,,,,,,,,,,,,,,,,,,,,,,,,,
Beans, Gourd & Cucumber, Other Vegetables,,,,,,,,,,,,,,,,,,,,,,,,,
Banana, Beans, Cream Biscuits, Glucose, Marie & Milk Biscuits, Health Drinks, Instant Noodles, Other Vegetables, Root Vegetables, Sugar, Sunflower Oils,,,,,,,,,,,,,,,,,
Banana, Beans, Cream Biscuits, Mosquito Repellent, Other Dals, Other Vegetables, Raw Rice, Rice Flour, Root Vegetables, Sugar, Sunflower Oils, Urad Dal,,,,,,,,,,,,,,,,
Avalakki / Poha, Banana, Beans, Chips, Exotic Vegetables, Organic Dals & Pulses, Organic F&V, Organic Rice & Rice Products, Other Dals, Other Dry Fruits, Other Vegetables, Raw Rice, Root Vegetables,,,,,,,,,,,,,,,
Floor Cleaners, Sugar,,,,,,,,,,,,,,,,,,,,,,,,,,
Moong Dal, Organic F&V, Sunflower Oils,,,,,,,,,,,,,,,,,,,,,,,,,
Beans, Instant Noodles, Liquid Detergent, Mosquito Repellent, Sugar, Whole Spices,,,,,,,,,,,,,,,,,,,,,,
