Boiled Rice, Health Drinks, Mosquito Repellent, Other Rice Products, Raw Rice, Root Vegetables, Sugar,,,,,,,,,,,,,,,,,,,,,
Avalakki / Poha, Beans, Gourd & Cucumber, Other Sweets, Other Vegetables, Root Vegetables, Sunflower Oils, Toor Dal, Whole Spices,,,,,,,,,,,,,,,,,,,
Banana, Beans, Cashews, Chips, Raw Rice, Snacky Nuts, Sooji & Rava, Toor Dal, Yogurt & Lassi,,,,,,,,,,,,,,,,,,,
Cakes, Cookies, Facial Tissues, Organic F&V,,,,,,,,,,,,,,,,,,,,,,,,
Namkeen, Other Dals, Other Sweets, Sunflower Oils,,,,,,,,,,,,,,,,,,,,,,,,
Beans, Gourd & Cucumber, Liquid Soaps & Bars, Other Vegetables,,,,,,,,,,,,,,,,,,,,,,,,
Gourd & Cucumber,,,,,,,,,,,,,,,,,,,,,,,,,,,
Avalakki / Poha, Beans, Exotic Vegetables, Gourd & Cucumber, Maida, Other Dals, Other Rice Products, Other Vegetables, Raisins, Raw Rice, Regular Pasta, Root Vegetables, Urad Dal, Whole Spices,,,,,,,,,,,,,,
Banana, Ghee, Root Vegetables,,,,,,,,,,,,,,,,,,,,,,,,,
Hair Colors & Dyes,,,,,,,,,,,,,,,,,,,,,,,,,,,
Banana, Beans, Other Sweets,,,,,,,,,,,,,,,,,,,,,,,,,
Cooking Sauce, Exotic Vegetables, Gourd & Cucumber, Instant Noodles, Other Vegetables, Raw Rice,,,,,,,,,,,,,,,,,,,,,,
Bakery & Breads, Beans, Cookies, Mosquito Repellent, Namkeen, Other Dals, Toor Dal,,,,,,,,,,,,,,,,,,,,,
Aluminium Foil & Cling Wrap, Cut Vegetables, Hair Oil, Home & Air Freshener, Other Sweets, Pain Relievers, Raisins, Sugar,,,,,,,,,,,,,,,,,,,,
Raisins, Raw Rice, Sooji & Rava, Urad Dal, Whole Spices,,,,,,,,,,,,,,,,,,,,,,,
Beans, Gourd & Cucumber, Other Dals, Other Rice Products, Other Vegetables, Root Vegetables, Toor Dal,,,,,,,,,,,,,,,,,,,,,
Bread, Cream Biscuits, Namkeen,,,,,,,,,,,,,,,,,,,,,,,,,
Moong Dal, Other Dals, Other Vegetables, Root Vegetables,,,,,,,,,,,,,,,,,,,,,,,,
Beans, Cooking Paste, Cooking Sauce, Namkeen, Other Sweets, Raisins, Root Vegetables,,,,,,,,,,,,,,,,,,,,,
Gourd & Cucumber, Other Vegetables, Raw Rice, Toor Dal,,,,,,,,,,,,,,,,,,,,,,,,
Cashews, Organic Rice & Rice Products, Raisins, Sooji & Rava, Sugar,,,,,,,,,,,,,,,,,,,,,,,
Banana, Organic Flours, Organic Juices, Other Rice Products, Root Vegetables,,,,,,,,,,,,,,,,,,,,,,,
Avalakki / Poha, Boiled Rice, Moong Dal, Other Dals, Other Flours, Other Rice Products, Other Sweets, Raw Rice, Sooji & Rava, Sugar, Toor Dal, Urad Dal, Whole Spices,,,,,,,,,,,,,,,
Banana, Colours , Face Cream, Other Oils,,,,,,,,,,,,,,,,,,,,,,,,
Raw Rice,,,,,,,,,,,,,,,,,,,,,,,,,,,
Beans, Ghee, Milk, Other Vegetables, Shaving Cream, Foam & Gels, Whole Spices,,,,,,,,,,,,,,,,,,,,,
Banana, Oats, Organic F&V, Organic Masalas & Spices, Other Sweets, Other Vegetables, Root Vegetables, Sugar,,,,,,,,,,,,,,,,,,,,
Banana, Boiled Rice, Exotic Vegetables, Ghee, Moong Dal, Other Dals, Raw Rice, Sooji & Rava, Toor Dal,,,,,,,,,,,,,,,,,,,
Namkeen,,,,,,,,,,,,,,,,,,,,,,,,,,,
Face Packs & Scrubs, Frozen Veg Food, Glucose, Marie & Milk Biscuits, Instant Noodles, Other Rice Products, Raisins,,,,,,,,,,,,,,,,,,,,,
Powdered Spices, Root Vegetables,,,,,,,,,,,,,,,,,,,,,,,,,,
Banana, Beans, Other Dals, Raw Peanuts, Root Vegetables,,,,,,,,,,,,,,,,,,,,,,,
Beans, Other Dals, Other Vegetables, Sooji & Rava, Sugar, Toor Dal,,,,,,,,,,,,,,,,,,,,,,
Beans, Cream Biscuits, Gourd & Cucumber, Ice Creams & Desserts, Maida, Moong Dal, Namkeen, Organic F&V, Other Dals, Other Jams, Other Sweets, Other Vegetables, Root Vegetables, Toor Dal, Urad Dal,,,,,,,,,,,,,
Banana, Beans, Boiled Rice, Gourd & Cucumber, Health Drinks, Organic Masalas & Spices, Other Flours, Rasagulla & Gulab Jamun, Rice Flour, Sooji & Rava, Whole Spices,,,,,,,,,,,,,,,,,
Banana, Exotic Vegetables, Ghee, Glucose, Marie & Milk Biscuits, Healthy & Digestive Biscuits, Liquid Detergent, Liquid Soaps & Bars, Mosquito Repellent, Organic Dals & Pulses, Organic Edible Oils & Ghee, Organic F&V, Organic Flours, Organic Juices, Organic Masalas & Spices, Organic Salt,Sugar & Jaggery, Other Dals, Toothpaste,,,,,,,,,
Banana, Beans, Corn Snacks, Organic F&V, Other Vegetables, Root Vegetables, Sugar,,,,,,,,,,,,,,,,,,,,,
Banana, Basmati Rice, Bread, Cakes, Mosquito Repellent, Muffins, Cookies & Rusk, Other Dals, Other Flours, Raw Peanuts, Raw Rice, Sugar, Sunflower Oils, Toor Dal, Urad Dal, Whole Spices,,,,,,,,,,,,
Avalakki / Poha, Bakery & Breads, Basmati Rice, Corn Snacks, Health Supplements, Ice Creams & Desserts, Namkeen, Other Dals,,,,,,,,,,,,,,,,,,,,
Avalakki / Poha, Beans, Gourd & Cucumber, Raw Rice, Sooji & Rava, Sugar, Sunflower Oils,,,,,,,,,,,,,,,,,,,,,
Hair Colors & Dyes, Organic Dry Fruits, Organic F&V, Root Vegetables,,,,,,,,,,,,,,,,,,,,,,,,
Avalakki / Poha, Besan, Maida, Other Dals, Other Rice Products, Raw Peanuts, Sugar, Toor Dal, Whole Spices,,,,,,,,,,,,,,,,,,,
Other Sweets, Whole Spices,,,,,,,,,,,,,,,,,,,,,,,,,,
Health Drinks, Organic Flours, Other Juices,,,,,,,,,,,,,,,,,,,,,,,,,
Avalakki / Poha, Basmati Rice, Beans, Besan, Cashews, Cooking Paste, Gourd & Cucumber, Jaggery, Maida, Moong Dal, Organic Baby Foods, Organic Branded Foods, Other Dals, Other Flours, Other Rice Products, Other Sweets, Other Vegetables, Raisins, Raw Peanuts, Raw Rice, Rice Flour, Root Vegetables, Shampoo, Sooji & Rava, Sugar, Toor Dal, Urad Dal, Whole Spices
Beans, Ground Coffee, Other Vegetables,,,,,,,,,,,,,,,,,,,,,,,,,
Bread, Cream Biscuits, Gourd & Cucumber, Other Vegetables, Root Vegetables,,,,,,,,,,,,,,,,,,,,,,,
Avalakki / Poha, Besan, Boiled Rice, Cashews, Chinese Noodles, Cream Biscuits, Health Drinks, Honey, Moong Dal, Namkeen, Organic Masalas & Spices, Other Dals, Other Rice Products, Phenyles & Acids, Raw Rice, Regular Pasta, Sooji & Rava, Toor Dal, Urad Dal, Whole Spices,,,,,,,,
Moong Dal, Organic Dals & Pulses, Organic F&V, Other Dals, Shaving Blade & Razors, Urad Dal, Whole Spices,,,,,,,,,,,,,,,,,,,,,
Banana, Curd, Eggs, Moong Dal, Other Dals, Root Vegetables, Toor Dal,,,,,,,,,,,,,,,,,,,,,
Beans, Other Vegetables, Sugar, Toor Dal,,,,,,,,,,,,,,,,,,,,,,,,
Butter & Cream, Gourd & Cucumber, Moong Dal, Organic Rice & Rice Products, Other Dals, Other Vegetables, Whole Spices,,,,,,,,,,,,,,,,,,,,,
Cream Biscuits, Ghee, Glucose, Marie & Milk Biscuits, Moong Dal, Other Dals, Other Vegetables, Root Vegetables, Sugar, Tomato Ketchup, Urad Dal, Whole Spices,,,,,,,,,,,,,,,,
Banana, Liquid Soaps & Bars, Organic F&V, Organic Masalas & Spices, Organic Rice & Rice Products, Root Vegetables,,,,,,,,,,,,,,,,,,,,,,
Beans, Boiled Rice, Bread, Cashews, Exotic Vegetables, Moong Dal, Organic F&V, Organic Rice & Rice Products, Other Rice Products, Other Vegetables, Root Vegetables, Whole Spices,,,,,,,,,,,,,,,,
Other Vegetables, Root Vegetables,,,,,,,,,,,,,,,,,,,,,,,,,,
Banana, Bread, Moong Dal, Organic Rice & Rice Products, Other Vegetables, Raw Rice, Sugar,,,,,,,,,,,,,,,,,,,,,
Gourd & Cucumber, Health Drinks, Namkeen, Other Sweets, Other Vegetables, Root Vegetables,,,,,,,,,,,,,,,,,,,,,,
Banana, Chips, Corn Snacks, Moong Dal, Other Vegetables, Root Vegetables,,,,,,,,,,,,,,,,,,,,,,
Avalakki / Poha, Besan, Exotic Vegetables, Face Wash, Gourd & Cucumber, Healthy & Digestive Biscuits, Maida, Moong Dal, Namkeen, Organic Dals & Pulses, Sooji & Rava, Whole Spices,,,,,,,,,,,,,,,,
Avalakki / Poha, Corn Snacks, Other Flours, Raw Peanuts, Raw Rice, Rice Flour, Root Vegetables, Shaving Blade & Razors, Sooji & Rava, Tomato Ketchup,,,,,,,,,,,,,,,,,,
Avalakki / Poha, Beans, Cashews, Cream Biscuits, Glucose, Marie & Milk Biscuits, Instant Noodles, Maida, Other Dals, Raw Peanuts, Raw Rice, Root Vegetables, Sooji & Rava, Sugar, Toor Dal, Urad Dal, Whole Spices,,,,,,,,,,,
Beans, Gourd & Cucumber, Root Vegetables,,,,,,,,,,,,,,,,,,,,,,,,,
Beans, Cakes, Cream Biscuits, Other Sweets, Other Vegetables, Root Vegetables,,,,,,,,,,,,,,,,,,,,,,
Beans, Bread, Other Vegetables, Root Vegetables, Sooji & Rava,,,,,,,,,,,,,,,,,,,,,,,
Aluminium Foil & Cling Wrap, Bread, Other Vegetables, Root Vegetables, Toor Dal,,,,,,,,,,,,,,,,,,,,,,,
Other Vegetables, Sunflower Oils,,,,,,,,,,,,,,,,,,,,,,,,,,
Avalakki / Poha, Beans, Besan, Maida, Moong Dal, Organic F&V, Organic Flours, Organic Rice & Rice Products, Other Rice Products, Raw Rice, Sunflower Oils, Urad Dal,,,,,,,,,,,,,,,,
Beans, Root Vegetables,,,,,,,,,,,,,,,,,,,,,,,,,,
Bread, Healthy & Digestive Biscuits, Packaged Drinking Water, Raw Rice,,,,,,,,,,,,,,,,,,,,,,,,
Organic Dals & Pulses, Organic F&V,,,,,,,,,,,,,,,,,,,,,,,,,,
Bread, Maida, Root Vegetables, Whole Spices,,,,,,,,,,,,,,,,,,,,,,,,
Other Dals, Other Vegetables, Soya Products, Sugar,,,,,,,,,,,,,,,,,,,,,,,,
Health Drinks, Raw Rice, Sugar, Whole Spices,,,,,,,,,,,,,,,,,,,,,,,,
Banana, Beans, Chips, Organic Juices, Other Sweets, Root Vegetables, Urad Dal,,,,,,,,,,,,,,,,,,,,,
Beans, Cooking Sauce, Organic F&V, Other Dals, Other Sweets, Raw Rice,,,,,,,,,,,,,,,,,,,,,,
Banana, Beans, Healthy & Digestive Biscuits, Namkeen, Other Sweets, Ready Baking Mixes, Root Vegetables, Sooji & Rava,,,,,,,,,,,,,,,,,,,,
Eggs, Exotic Vegetables, Other Dals, Root Vegetables,,,,,,,,,,,,,,,,,,,,,,,,
Bread, Organic F&V, Other Sweets,,,,,,,,,,,,,,,,,,,,,,,,,
Eggs, Milk, Mosquito Repellent, Organic Rice & Rice Products, Other Sweets, Other Vegetables, Raw Rice, Root Vegetables, Sunflower Oils,,,,,,,,,,,,,,,,,,,
Avalakki / Poha, Banana, Basmati Rice, Beans, Body Wash, Flakes, Health Supplements, Home & Air Freshener, Instant Noodles, Liquid Soaps & Bars, Moong Dal, Mouthwash, Namkeen, Other Dals, Other Rice Products, Other Sweets, Root Vegetables, Whole Spices,,,,,,,,,,
Banana, Organic Rice & Rice Products, Other Sweets,,,,,,,,,,,,,,,,,,,,,,,,,
Banana, Namkeen, Other Dals, Other Sweets, Root Vegetables, Snacky Nuts,,,,,,,,,,,,,,,,,,,,,,
Beans, Besan, Chips, Glucose, Marie & Milk Biscuits, Moong Dal, Organic F&V, Other Dals, Other Sweets, Root Vegetables, Urad Dal,,,,,,,,,,,,,,,,,
Chips, Health Drinks, Instant Pastas, Other Sweets, Packaged Drinking Water,,,,,,,,,,,,,,,,,,,,,,,
Banana, Hair Colors & Dyes, Other Sweets, Other Vegetables,,,,,,,,,,,,,,,,,,,,,,,,
Cream Biscuits, Other Dals, Other Sweets, Sooji & Rava,,,,,,,,,,,,,,,,,,,,,,,,
Beans, Other Sweets, Root Vegetables,,,,,,,,,,,,,,,,,,,,,,,,,
Beans, Bread, Cream Biscuits, Gourd & Cucumber, Other Sweets, Other Vegetables, Root Vegetables, Toor Dal,,,,,,,,,,,,,,,,,,,,
Beans, Moong Dal, Mosquito Repellent, Other Sweets, Other Vegetables, Raw Rice, Shaving Blade & Razors, Toor Dal, Whole Spices,,,,,,,,,,,,,,,,,,,
Beans, Gourd & Cucumber, Other Vegetables, Root Vegetables,,,,,,,,,,,,,,,,,,,,,,,,
Beans, Organic Branded Foods, Organic Masalas & Spices, Other Sweets, Root Vegetables,,,,,,,,,,,,,,,,,,,,,,,
Beans, Bread, Exotic Vegetables, Namkeen, Other Dals, Other Pickle, Other Sweets, Other Vegetables, Root Vegetables, Urad Dal,,,,,,,,,,,,,,,,,,
Bread, Cooking Paste, Gourd & Cucumber, Other Sweets, Other Vegetables, Root Vegetables, Toor Dal,,,,,,,,,,,,,,,,,,,,,
Besan, Cashews, Other Sweets, Regular Pasta, Sooji & Rava,,,,,,,,,,,,,,,,,,,,,,,
Gourd & Cucumber, Organic Rice & Rice Products, Other Sweets, Other Vegetables,,,,,,,,,,,,,,,,,,,,,,,,
Banana, Chips, Other Sweets, Other Vegetables,,,,,,,,,,,,,,,,,,,,,,,,
Banana, Curd, Glucose, Marie & Milk Biscuits, Other Sweets, Whole Grains,,,,,,,,,,,,,,,,,,,,,,
Beans, Gourd & Cucumber, Ground Coffee, Mosquito Repellent, Other Sweets, Other Vegetables, Root Vegetables, Sooji & Rava, Whole Spices,,,,,,,,,,,,,,,,,,,
Cream Biscuits, Other Sweets, Other Vegetables,,,,,,,,,,,,,,,,,,,,,,,,,
Glucose, Marie & Milk Biscuits, Moong Dal, Other Sweets, Raw Rice, Toor Dal,,,,,,,,,,,,,,,,,,,,,,
Other Pickle, Other Sweets, Other Vegetables,,,,,,,,,,,,,,,,,,,,,,,,,
Organic F&V, Organic Rice & Rice Products, Other Sweets,,,,,,,,,,,,,,,,,,,,,,,,,
Beans, Bread, Other Sweets, Other Vegetables, Root Vegetables,,,,,,,,,,,,,,,,,,,,,,,
Beans, Gourd & Cucumber, Health Drinks, Oats, Other Sweets, Other Vegetables, Raw Peanuts, Whole Spices,,,,,,,,,,,,,,,,,,,,
Beans, Gourd & Cucumber, Namkeen, Other Sweets, Other Vegetables, Root Vegetables,,,,,,,,,,,,,,,,,,,,,,
Root Vegetables,,,,,,,,,,,,,,,,,,,,,,,,,,,
Raw Rice,,,,,,,,,,,,,,,,,,,,,,,,,,,
Banana, Beans, Besan, Health Drinks, Namkeen, Other Dry Fruits,,,,,,,,,,,,,,,,,,,,,,
Banana, Beans, Boiled Rice, Cooking Paste, Ghee, Health Drinks, Organic Masalas & Spices, Other Rice Products, Other Sweets, Root Vegetables, Whole Spices,,,,,,,,,,,,,,,,,
Beans, Gourd & Cucumber, Other Sweets, Other Vegetables, Root Vegetables, Whole Spices,,,,,,,,,,,,,,,,,,,,,,
Besan, Bread, Cooking Sauce, Moong Dal, Organic Dry Fruits, Other Dals, Other Dry Fruits, Other Sweets, Other Vegetables, Root Vegetables, Urad Dal, Whole Spices,,,,,,,,,,,,,,,,
Banana,,,,,,,,,,,,,,,,,,,,,,,,,,,
Organic Dals & Pulses, Organic F&V, Organic Flours, Organic Rice & Rice Products, Other Rice Products, Other Sweets, Other Vegetables, Root Vegetables,,,,,,,,,,,,,,,,,,,,
Bread, Exotic Vegetables, Glucose, Marie & Milk Biscuits, Other Sweets, Other Vegetables, Root Vegetables,,,,,,,,,,,,,,,,,,,,,
Beans, Boiled Rice, Other Sweets, Shampoo, Sooji & Rava, Sugar,,,,,,,,,,,,,,,,,,,,,,
Banana, Beans, Other Dals, Other Sweets, Other Vegetables, Root Vegetables,,,,,,,,,,,,,,,,,,,,,,
Aluminium Foil & Cling Wrap, Basmati Rice, Besan, Bread, Cookies, Moong Dal, Namkeen, Other Vegetables, Urad Dal,,,,,,,,,,,,,,,,,,,
Basmati Rice, Bread, Namkeen, Other Sweets, Packaged Drinking Water, Raisins, Raw Rice,,,,,,,,,,,,,,,,,,,,,
Beans, Cashews, Gourd & Cucumber, Other Rice Products, Other Sweets, Other Vegetables, Root Vegetables, Sooji & Rava, Sugar,,,,,,,,,,,,,,,,,,,
Banana, Bread, Cooking Sauce, Cream Biscuits, Namkeen,,,,,,,,,,,,,,,,,,,,,,,
Bakery & Breads, Beans, Cookies, Ground Coffee, Other Dals, Other Sweets, Raw Rice, Tomato Ketchup, Whole Spices,,,,,,,,,,,,,,,,,,,
Banana, Cashews, Namkeen, Other Dals, Other Rice Products, Other Sauces, Other Sweets, Sugar, Sugar Cubes,,,,,,,,,,,,,,,,,,,
Banana, Gourd & Cucumber, Raw Rice, Root Vegetables, Toor Dal,,,,,,,,,,,,,,,,,,,,,,,
Bread, Exotic Vegetables, Gourd & Cucumber, Other Sweets, Other Vegetables, Root Vegetables, Sooji & Rava,,,,,,,,,,,,,,,,,,,,,
Cookies, Healthy & Digestive Biscuits, Moong Dal, Organic Masalas & Spices, Other Dry Fruits, Other Rice Products, Other Sweets, Other Vegetables, Root Vegetables,,,,,,,,,,,,,,,,,,,
Health Drinks, Other Sauces, Whole Spices,,,,,,,,,,,,,,,,,,,,,,,,,
Cream Biscuits, Namkeen, Organic F&V, Other Juices, Other Sweets, Regular Pasta,,,,,,,,,,,,,,,,,,,,,,
Healthy & Digestive Biscuits, Other Rice Products, Other Sweets, Raisins,,,,,,,,,,,,,,,,,,,,,,,,
Boiled Rice, Other Dals, Other Sweets, Raw Peanuts, Sunflower Oils, Toor Dal,,,,,,,,,,,,,,,,,,,,,,
Bread, Other Sweets, Snacky Nuts,,,,,,,,,,,,,,,,,,,,,,,,,
Banana, Basmati Rice, Beans, Organic F&V, Other Vegetables, Root Vegetables, Sooji & Rava,,,,,,,,,,,,,,,,,,,,,
Banana, Cashews, Gourd & Cucumber, Liquid Soaps & Bars, Organic Masalas & Spices, Other Vegetables, Raw Rice, Root Vegetables,,,,,,,,,,,,,,,,,,,,
Avalakki / Poha, Cashews, Exotic Vegetables, Moong Dal, Namkeen, Organic F&V, Other Dals, Other Dry Fruits, Other Flours, Other Sweets, Pasta & Noodles, Pre & Post Wash Care, Sooji & Rava, Urad Dal,,,,,,,,,,,,,,
Glucose, Marie & Milk Biscuits, Whole Spices,,,,,,,,,,,,,,,,,,,,,,,,,
Beans, Root Vegetables,,,,,,,,,,,,,,,,,,,,,,,,,,
Beans, Instant Pastas, Moong Dal, Other Dals, Raw Peanuts, Root Vegetables, Whole Spices,,,,,,,,,,,,,,,,,,,,,
Avalakki / Poha, Banana, Beans, Moong Dal, Other Dals, Other Pooja Needs, Other Vegetables, Raisins, Root Vegetables, Toor Dal, Whole Spices,,,,,,,,,,,,,,,,,
Cut Vegetables, Exotic Vegetables, Healthy & Digestive Biscuits,,,,,,,,,,,,,,,,,,,,,,,,,
Other Sweets, Raw Peanuts, Sugar, Whole Spices,,,,,,,,,,,,,,,,,,,,,,,,
Beans, Organic Dry Fruits, Other Sweets, Other Vegetables, Root Vegetables,,,,,,,,,,,,,,,,,,,,,,,
Ground Coffee, Mango Juices,,,,,,,,,,,,,,,,,,,,,,,,,,
Avalakki / Poha, Colours , Honey, Other Dals, Raisins, Scissors, Glue & Tape, Whole Spices,,,,,,,,,,,,,,,,,,,,
Banana, Beans, Other Vegetables, Toothpaste, Whole Spices,,,,,,,,,,,,,,,,,,,,,,,
Beans, Bread, Sugar,,,,,,,,,,,,,,,,,,,,,,,,,
Banana, Cream Biscuits, Organic F&V, Other Sweets, Other Vegetables, Root Vegetables, Sunflower Oils, Veg & Fruit,,,,,,,,,,,,,,,,,,,,
Banana, Cleaning & Dust Cloth, Other Vegetables,,,,,,,,,,,,,,,,,,,,,,,,,
Health Supplements,,,,,,,,,,,,,,,,,,,,,,,,,,,
Banana, Beans, Cooking Paste, Frozen Chicken, Health Drinks, Moong Dal, Other Vegetables, Raw Rice, Root Vegetables, Whole Spices,,,,,,,,,,,,,,,,,,
Drain Cleaners, Hair Colors & Dyes, Mosquito Repellent, Other Sweets, Other Vegetables, Root Vegetables, Shampoo, Sooji & Rava,,,,,,,,,,,,,,,,,,,,
Organic Dals & Pulses, Organic F&V, Other Rice Products, Raisins, Root Vegetables, Sooji & Rava, Sugar,,,,,,,,,,,,,,,,,,,,,
Avalakki / Poha, Liquid Soaps & Bars, Other Dals, Other Rice Products, Other Sweets, Powdered Spices, Raw Rice, Rice Flour, Sugar, Toor Dal, Urad Dal, Whole Spices,,,,,,,,,,,,,,,,
Cream Biscuits, Healthy & Digestive Biscuits,,,,,,,,,,,,,,,,,,,,,,,,,,
Banana, Besan, Drain Cleaners, Healthy & Digestive Biscuits, Moong Dal, Namkeen, Organic F&V, Other Dals, Other Sweets, Other Vegetables, Raw Peanuts, Root Vegetables, Sooji & Rava, Sugar, Toor Dal, Whole Spices,,,,,,,,,,,,
Bread, Exotic Vegetables, Other Vegetables,,,,,,,,,,,,,,,,,,,,,,,,,
Banana, Besan,,,,,,,,,,,,,,,,,,,,,,,,,,
Beans, Exotic Vegetables, Organic F&V, Other Vegetables, Root Vegetables,,,,,,,,,,,,,,,,,,,,,,,
Beans, Cream Biscuits, Gourd & Cucumber, Other Vegetables, Root Vegetables,,,,,,,,,,,,,,,,,,,,,,,
Banana, Mosquito Repellent, Namkeen, Snacky Nuts,,,,,,,,,,,,,,,,,,,,,,,,
Corn Snacks, Liquid Soaps & Bars, Moong Dal, Namkeen, Other Dals, Other Vegetables, Paneer & Tofu,,,,,,,,,,,,,,,,,,,,,
Gourd & Cucumber, Honey, Other Vegetables,,,,,,,,,,,,,,,,,,,,,,,,,
Organic Dals & Pulses, Organic Rice & Rice Products, Sooji & Rava, Sunflower Oils, Whole Spices,,,,,,,,,,,,,,,,,,,,,,,
Banana, Boiled Rice, Other Oils,,,,,,,,,,,,,,,,,,,,,,,,,
Beans, Organic F&V, Root Vegetables,,,,,,,,,,,,,,,,,,,,,,,,,
Beans, Other Vegetables,,,,,,,,,,,,,,,,,,,,,,,,,,
Cream Biscuits, Ice Creams & Desserts, Organic Rice & Rice Products, Other Vegetables, Root Vegetables, Whole Spices,,,,,,,,,,,,,,,,,,,,,,
Liquid Soaps & Bars, Other Vegetables,,,,,,,,,,,,,,,,,,,,,,,,,,
Organic F&V, Organic Masalas & Spices, Root Vegetables,,,,,,,,,,,,,,,,,,,,,,,,,
Oats, Organic Dry Fruits, Other Rice Products,,,,,,,,,,,,,,,,,,,,,,,,,
Other Dals,,,,,,,,,,,,,,,,,,,,,,,,,,,
Honey, Other Sweets,,,,,,,,,,,,,,,,,,,,,,,,,,
Organic F&V,,,,,,,,,,,,,,,,,,,,,,,,,,,
Boiled Rice, Cakes, Other Dals, Other Rice Products, Toor Dal, Utensil Scrub Pads,,,,,,,,,,,,,,,,,,,,,,
Bread, Packaged Drinking Water, Toothpaste,,,,,,,,,,,,,,,,,,,,,,,,,
Beans, Honey, Root Vegetables, Toor Dal,,,,,,,,,,,,,,,,,,,,,,,,
Beans, Other Rice Products, Other Sweets, Other Vegetables, Raw Rice, Sugar, Toor Dal,,,,,,,,,,,,,,,,,,,,,
Besan, Boiled Rice, Ground Coffee, Namkeen,,,,,,,,,,,,,,,,,,,,,,,,
Ghee, Organic Dals & Pulses, Organic Flours, Organic Rice & Rice Products,,,,,,,,,,,,,,,,,,,,,,,,
Besan, Chips, Organic F&V, Other Dals, Root Vegetables, Snacky Nuts, Sooji & Rava, Whole Spices,,,,,,,,,,,,,,,,,,,,
Beans, Exotic Vegetables,,,,,,,,,,,,,,,,,,,,,,,,,,
Aluminium Foil & Cling Wrap, Bread, Cream Biscuits, Other Dry Fruits, Other Oils, Other Vegetables,,,,,,,,,,,,,,,,,,,,,,
Chips, Cut Vegetables, Liquid Soaps & Bars, Root Vegetables,,,,,,,,,,,,,,,,,,,,,,,,
Beans, Butter & Cream, Cashews, Chips, Corn Snacks, Exotic Vegetables, Jams & Sauces, Root Vegetables,,,,,,,,,,,,,,,,,,,,
Banana, Beans, Exotic Vegetables, Milk Drinks, Organic F&V, Other Vegetables, Ready Baking Mixes, Root Vegetables,,,,,,,,,,,,,,,,,,,,
Beans, Besan, Cashews, Glucose, Marie & Milk Biscuits, Gourd & Cucumber, Hair Oil, Raisins, Sugar, Sugar Cubes, Whole Spices,,,,,,,,,,,,,,,,,
Aluminium Foil & Cling Wrap, Banana, Beans, Ghee, Muffins, Cookies & Rusk, Organic F&V, Raw Peanuts, Root Vegetables, Snacky Nuts,,,,,,,,,,,,,,,,,,
Bread, Gourd & Cucumber, Other Dals, Other Vegetables, Sugar, Whole Spices,,,,,,,,,,,,,,,,,,,,,,
Beans, Besan, Maida, Other Dry Fruits, Other Vegetables, Raw Rice, Root Vegetables, Whole Spices,,,,,,,,,,,,,,,,,,,,
Gourd & Cucumber, Health Supplements, Moong Dal, Namkeen, Other Vegetables, Sugar, Urad Dal, Whole Spices,,,,,,,,,,,,,,,,,,,,
Bread, Organic Rice & Rice Products, Raw Rice,,,,,,,,,,,,,,,,,,,,,,,,,
Organic F&V,,,,,,,,,,,,,,,,,,,,,,,,,,,
Banana, Beans, Exotic Vegetables, Moong Dal, Namkeen, Organic F&V, Other Dals, Other Pickle, Other Vegetables, Root Vegetables, Toor Dal, Whole Spices,,,,,,,,,,,,,,,,
Cashews, Ground Coffee, Other Dry Fruits, Other Vegetables, Raisins, Rice Flour, Root Vegetables,,,,,,,,,,,,,,,,,,,,,
Bakery & Breads, Chips, Curd, Eggs, Exotic Vegetables, Other Dals, Root Vegetables, Toor Dal,,,,,,,,,,,,,,,,,,,,
Ayurvedic Food, Chips, Other Dals, Other Vegetables, Raw Peanuts, Whole Spices,,,,,,,,,,,,,,,,,,,,,,
Beans, Boiled Rice, Exotic Vegetables, Organic Dals & Pulses, Organic F&V, Other Dry Fruits, Other Vegetables, Root Vegetables,,,,,,,,,,,,,,,,,,,,
Root Vegetables,,,,,,,,,,,,,,,,,,,,,,,,,,,
Chips, Eggs, Flakes, Gourd & Cucumber, Organic Dals & Pulses, Organic Flours, Organic Salt,Sugar & Jaggery, Other Rice Products, Root Vegetables,,,,,,,,,,,,,,,,,,
Gourd & Cucumber, Other Oils, Urad Dal, Whole Spices,,,,,,,,,,,,,,,,,,,,,,,,
Boiled Rice, Moong Dal, Organic Flours, Other Dals, Other Vegetables, Toor Dal, Urad Dal, Whole Spices,,,,,,,,,,,,,,,,,,,,
Beans, Chips, Healthy & Digestive Biscuits, Root Vegetables, Whole Spices,,,,,,,,,,,,,,,,,,,,,,,
Chips, Honey, Namkeen,,,,,,,,,,,,,,,,,,,,,,,,,
Banana, Beans, Chips, Health Drinks, Liquid Soaps & Bars, Muffins, Cookies & Rusk,,,,,,,,,,,,,,,,,,,,,
Besan, Exotic Vegetables, Sooji & Rava, Sunflower Oils,,,,,,,,,,,,,,,,,,,,,,,,
Bread, Health Drinks, Root Vegetables, Sunflower Oils, Toor Dal,,,,,,,,,,,,,,,,,,,,,,,
Beans, Other Vegetables,,,,,,,,,,,,,,,,,,,,,,,,,,
Banana, Beans, Curd, Frozen Veg Food, Moong Dal, Other Vegetables, Raw Peanuts, Root Vegetables, Yogurt & Lassi,,,,,,,,,,,,,,,,,,,
Chips, Raw Rice, Sunflower Oils,,,,,,,,,,,,,,,,,,,,,,,,,
Banana, Beans, Cashews, Chips, Cream Biscuits, Ice Creams & Desserts, Other Dals, Other Vegetables, Root Vegetables, Sooji & Rava, Soya Products,,,,,,,,,,,,,,,,,
Bakery & Breads, Banana, Bread, Chips, Cookies, Corn Snacks, Other Vegetables, Toor Dal,,,,,,,,,,,,,,,,,,,,
Beans, Cream Biscuits, Gourd & Cucumber, Other Vegetables, Root Vegetables,,,,,,,,,,,,,,,,,,,,,,,
Milk, Organic F&V, Sugar,,,,,,,,,,,,,,,,,,,,,,,,,
Chips, Gourd & Cucumber, Root Vegetables, Whole Spices,,,,,,,,,,,,,,,,,,,,,,,,
Aluminium Foil & Cling Wrap, Beans, Chips, Gourd & Cucumber, Other Dals, Sugar, Sunflower Oils,,,,,,,,,,,,,,,,,,,,,
Organic Rice & Rice Products, Other Vegetables, Paneer & Tofu, Root Vegetables,,,,,,,,,,,,,,,,,,,,,,,,
Bread, Jaggery, Root Vegetables, Sugar, Whole Spices, Yogurt & Lassi,,,,,,,,,,,,,,,,,,,,,,
Banana, Beans, Exotic Vegetables, Other Vegetables, Root Vegetables,,,,,,,,,,,,,,,,,,,,,,,
Chips, Exotic Vegetables, Jaggery, Other Dals, Other Vegetables, Sugar, Toor Dal,,,,,,,,,,,,,,,,,,,,,
Besan, Bread, Chips, Packaged Drinking Water, Raw Rice, Shaving Blade & Razors, Shaving Cream, Foam & Gels, Whole Spices,,,,,,,,,,,,,,,,,,,
Cashews, Cut Vegetables, Face Wash, Home & Air Freshener, Other Dals, Other Vegetables, Raw Peanuts, Sunflower Oils, Toor Dal,,,,,,,,,,,,,,,,,,,
Banana, Chips, Ghee, Organic Dals & Pulses, Organic Dry Fruits, Organic F&V, Organic Flours, Organic Juices, Organic Masalas & Spices, Organic Rice & Rice Products, Other Vegetables, Toffee & Candy,,,,,,,,,,,,,,,,
Banana, Beans, Root Vegetables, Snacky Nuts,,,,,,,,,,,,,,,,,,,,,,,,
Banana,,,,,,,,,,,,,,,,,,,,,,,,,,,
Banana, Chips, Exotic Vegetables, Health Drinks, Honey, Jaggery, Raw Peanuts, Root Vegetables, Sugar,,,,,,,,,,,,,,,,,,,
Chips, Exotic Vegetables, Moong Dal, Other Dals, Urad Dal,,,,,,,,,,,,,,,,,,,,,,,
Besan,,,,,,,,,,,,,,,,,,,,,,,,,,,
Boiled Rice, Chips, Jaggery, Other Dals, Raisins, Urad Dal,,,,,,,,,,,,,,,,,,,,,,
Exotic Vegetables, Milk, Organic F&V, Other Dals, Root Vegetables,,,,,,,,,,,,,,,,,,,,,,,
Rasagulla & Gulab Jamun,,,,,,,,,,,,,,,,,,,,,,,,,,,
Banana, Cashews, Organic Masalas & Spices, Other Dals, Other Dry Fruits, Raisins, Sugar Cubes, Whole Spices,,,,,,,,,,,,,,,,,,,,
Namkeen, Other Dals,,,,,,,,,,,,,,,,,,,,,,,,,,
Shoe Polish,,,,,,,,,,,,,,,,,,,,,,,,,,,
Banana, Chips, Cream Biscuits, Exotic Vegetables, Instant Noodles, Organic F&V, Raw Rice, Root Vegetables, Toor Dal,,,,,,,,,,,,,,,,,,,
Avalakki / Poha, Besan, Boiled Rice, Cashews, Chips, Ground Coffee, Hand Wash, Honey, Jaggery, Maida, Moong Dal, Organic Rice & Rice Products, Other Dals, Other Dry Fruits, Raisins, Raw Peanuts, Rice Flour, Shaving Blade & Razors, Sooji & Rava, Toor Dal, Urad Dal, Whole Spices,,,,,,
Beans, Ground Coffee, Mango Juices, Organic F&V, Other Dals, Toor Dal,,,,,,,,,,,,,,,,,,,,,,
Chips, Corn Snacks, Namkeen,,,,,,,,,,,,,,,,,,,,,,,,,
Cotton & Bandages, Face Wash, Organic F&V, Root Vegetables,,,,,,,,,,,,,,,,,,,,,,,,
Avalakki / Poha, Bread, Chinese Noodles, Chips, Cream Biscuits, Namkeen, Other Dry Fruits, Other Rice Products, Rice Flour, Sugar, Whole Spices,,,,,,,,,,,,,,,,,
Beans, Organic F&V, Root Vegetables,,,,,,,,,,,,,,,,,,,,,,,,,
Chips, Cookies, Cream Biscuits, Healthy & Digestive Biscuits, Namkeen, Other Juices,,,,,,,,,,,,,,,,,,,,,,
Avalakki / Poha, Beans, Bread, Cookies, Face Cream, Sugar,,,,,,,,,,,,,,,,,,,,,,
Beans, Gourd & Cucumber, Other Rice Products, Other Vegetables, Sooji & Rava, Toor Dal, Urad Dal, Whole Spices,,,,,,,,,,,,,,,,,,,,
Banana, Cashews, Organic F&V, Other Dry Fruits, Other Vegetables, Raisins, Root Vegetables, Sooji & Rava, Sunflower Oils,,,,,,,,,,,,,,,,,,,
Banana, Other Vegetables, Root Vegetables,,,,,,,,,,,,,,,,,,,,,,,,,
Bread,,,,,,,,,,,,,,,,,,,,,,,,,,,
Bakery & Breads, Cookies, Namkeen, Other Dals, Toor Dal, Whole Spices,,,,,,,,,,,,,,,,,,,,,,
Banana, Beans, Chips, Drain Cleaners, Ghee, Root Vegetables, Whole Spices,,,,,,,,,,,,,,,,,,,,,
Banana, Healthy & Digestive Biscuits,,,,,,,,,,,,,,,,,,,,,,,,,,
