Banana, Beans, Chips, Cooking Sauce, Cotton & Bandages, Instant Noodles, Liquid Soaps & Bars, Maida, Namkeen, Other Dals, Raw Peanuts, Ready Mix, Snacky Nuts, Vermicelli,,,,,,,,,,,,,,
Banana, Beans, Boiled Rice, Gourd & Cucumber, Moong Dal, Namkeen, Organic F&V, Other Dals, Other Vegetables, Root Vegetables, Whole Spices,,,,,,,,,,,,,,,,,
Banana, Organic F&V, Other Dals, Urad Dal, Whole Spices,,,,,,,,,,,,,,,,,,,,,,,
Basmati Rice,,,,,,,,,,,,,,,,,,,,,,,,,,,
Banana, Bread, Jaggery, Other Dals, Raw Peanuts, Root Vegetables, Snacky Nuts,,,,,,,,,,,,,,,,,,,,,
Bread, Moong Dal, Organic Dals & Pulses, Other Dals, Raw Peanuts, Raw Rice, Urad Dal,,,,,,,,,,,,,,,,,,,,,
Boiled Rice, Cashews, Gourd & Cucumber, Namkeen, Other Dals, Other Vegetables, Sooji & Rava,,,,,,,,,,,,,,,,,,,,,
Beans, Glucose, Marie & Milk Biscuits, Gourd & Cucumber, Other Dals, Other Vegetables,,,,,,,,,,,,,,,,,,,,,,
Cashews, Other Dals, Raisins, Regular Pasta,,,,,,,,,,,,,,,,,,,,,,,,
Beans, Bread, Cooking Paste, Gourd & Cucumber, Organic F&V, Other Vegetables, Root Vegetables, Shoe Polish, Sugar,,,,,,,,,,,,,,,,,,,
Namkeen,,,,,,,,,,,,,,,,,,,,,,,,,,,
Root Vegetables, Sugar, Toor Dal,,,,,,,,,,,,,,,,,,,,,,,,,
Organic F&V, Other Vegetables, Root Vegetables,,,,,,,,,,,,,,,,,,,,,,,,,
Beans, Gourd & Cucumber, Other Vegetables,,,,,,,,,,,,,,,,,,,,,,,,,
Gourd & Cucumber, Other Vegetables,,,,,,,,,,,,,,,,,,,,,,,,,,
Banana, Organic Dals & Pulses, Organic F&V, Organic Flours, Organic Rice & Rice Products, Organic Salt,Sugar & Jaggery, Other Dals, Other Dry Fruits, Other Rice Products, Other Vegetables, Raisins,,,,,,,,,,,,,,,,
Beans, Corn Snacks, Gourd & Cucumber, Namkeen, Other Vegetables, Sugar, Tomato Ketchup,,,,,,,,,,,,,,,,,,,,,
Banana, Chilli & Soya Sauces, Other Dry Fruits, Other Pooja Needs, Whole Spices,,,,,,,,,,,,,,,,,,,,,,,
Beans, Besan, Health Drinks, Root Vegetables, Whole Spices,,,,,,,,,,,,,,,,,,,,,,,
Beans, Namkeen, Other Dals,,,,,,,,,,,,,,,,,,,,,,,,,
Beans, Gourd & Cucumber, Mustard Oils, Other Dals, Other Rice Products, Other Vegetables, Root Vegetables,,,,,,,,,,,,,,,,,,,,,
Aluminium Foil & Cling Wrap, Banana, Beans, Cream Biscuits, Exotic Vegetables, Gourd & Cucumber, Health Drinks, Ice Creams & Desserts, Namkeen, Other Dals, Other Vegetables, Raw Peanuts, Root Vegetables, Toor Dal,,,,,,,,,,,,,,
Gourd & Cucumber, Moong Dal, Other Dals, Other Vegetables, Toor Dal, Urad Dal,,,,,,,,,,,,,,,,,,,,,,
Banana, Beans, Other Rice Products, Other Vegetables, Root Vegetables, Sugar, Toor Dal, Urad Dal,,,,,,,,,,,,,,,,,,,,
Whole Spices,,,,,,,,,,,,,,,,,,,,,,,,,,,
Organic Dals & Pulses, Organic Rice & Rice Products,,,,,,,,,,,,,,,,,,,,,,,,,,
Beans, Organic Rice & Rice Products, Other Vegetables, Regular Pasta, Root Vegetables,,,,,,,,,,,,,,,,,,,,,,,
Gourd & Cucumber, Organic F&V, Other Dals, Other Oils, Other Vegetables,,,,,,,,,,,,,,,,,,,,,,,
Organic Flours,,,,,,,,,,,,,,,,,,,,,,,,,,,
Beans, Face Wash, Health Drinks, Mosquito Repellent, Other Dals,,,,,,,,,,,,,,,,,,,,,,,
Beans, Root Vegetables, Sunflower Oils,,,,,,,,,,,,,,,,,,,,,,,,,
Exotic Vegetables, Health Drinks, Namkeen, Other Vegetables,,,,,,,,,,,,,,,,,,,,,,,,
Honey,,,,,,,,,,,,,,,,,,,,,,,,,,,
Cream Biscuits, Raw Rice, Sooji & Rava, Whole Spices,,,,,,,,,,,,,,,,,,,,,,,,
Gourd & Cucumber, Other Dals, Whole Spices,,,,,,,,,,,,,,,,,,,,,,,,,
Bread, Maida, Raw Rice, Sugar, Toor Dal, Urad Dal, Vanaspati,,,,,,,,,,,,,,,,,,,,,
Corn Snacks, Namkeen, Organic F&V,,,,,,,,,,,,,,,,,,,,,,,,,
Ice Creams & Desserts, Jaggery, Other Dry Fruits, Raw Peanuts, Whole Spices,,,,,,,,,,,,,,,,,,,,,,,
Organic Dals & Pulses, Organic F&V, Organic Rice & Rice Products,,,,,,,,,,,,,,,,,,,,,,,,,
Beans, Boiled Rice, Glucose, Marie & Milk Biscuits, Health Drinks, Health Supplements, Moong Dal, Mustard Oils, Namkeen, Other Dals, Other Vegetables, Raw Rice, Root Vegetables, Sooji & Rava, Sugar,,,,,,,,,,,,,
Banana, Exotic Vegetables, Root Vegetables,,,,,,,,,,,,,,,,,,,,,,,,,
Beans, Gourd & Cucumber, Maida,,,,,,,,,,,,,,,,,,,,,,,,,
Banana, Beans, Root Vegetables,,,,,,,,,,,,,,,,,,,,,,,,,
Boiled Rice, Other Dals, Other Rice Products, Raw Rice, Urad Dal, Whole Grains,,,,,,,,,,,,,,,,,,,,,,
Beans, Boiled Rice, Gourd & Cucumber, Other Sauces, Other Vegetables, Raw Rice, Root Vegetables, Toor Dal, Urad Dal, Whole Spices,,,,,,,,,,,,,,,,,,
Avalakki / Poha, Banana, Glucose, Marie & Milk Biscuits, Ice Creams & Desserts, Moong Dal, Ready Baking Mixes,,,,,,,,,,,,,,,,,,,,,
Other Vegetables,,,,,,,,,,,,,,,,,,,,,,,,,,,
Whole Spices,,,,,,,,,,,,,,,,,,,,,,,,,,,
Beans, Gourd & Cucumber, Other Vegetables, Root Vegetables,,,,,,,,,,,,,,,,,,,,,,,,
Exotic Vegetables, Toor Dal, Whole Spices,,,,,,,,,,,,,,,,,,,,,,,,,
Cream Biscuits, Gourd & Cucumber, Liquid Soaps & Bars, Other Vegetables, Raw Rice, Root Vegetables, Shaving Blade & Razors,,,,,,,,,,,,,,,,,,,,,
Beans, Exotic Vegetables, Other Vegetables, Root Vegetables,,,,,,,,,,,,,,,,,,,,,,,,
Avalakki / Poha, Banana, Beans, Cooking Paste, Moong Dal, Other Dals, Other Vegetables, Raw Rice, Root Vegetables,,,,,,,,,,,,,,,,,,,
Exotic Vegetables, Ghee, Moong Dal, Other Dals, Sunflower Oils, Toor Dal,,,,,,,,,,,,,,,,,,,,,,
Face Cream, Other Rice Products, Other Sweets, Raw Rice, Root Vegetables, Sunflower Oils, Toor Dal,,,,,,,,,,,,,,,,,,,,,
Avalakki / Poha, Banana, Exotic Vegetables, Health Drinks, Instant Noodles, Jaggery, Liquid Soaps & Bars, Mosquito Repellent, Other Flours, Other Vegetables, Raw Rice, Rice Flour, Root Vegetables, Sooji & Rava, Sugar, Sunflower Oils,,,,,,,,,,,,
Cooking Sauce, Organic F&V, Other Dals, Other Dry Fruits,,,,,,,,,,,,,,,,,,,,,,,,
Gourd & Cucumber, Other Vegetables, Root Vegetables,,,,,,,,,,,,,,,,,,,,,,,,,
Exotic Vegetables, Glucose, Marie & Milk Biscuits, Gourd & Cucumber, Moong Dal, Organic F&V, Root Vegetables, Whole Grains, Whole Spices,,,,,,,,,,,,,,,,,,,
Avalakki / Poha, Boiled Rice, Instant Noodles, Mustard Oils,,,,,,,,,,,,,,,,,,,,,,,,
Liquid Detergent, Root Vegetables,,,,,,,,,,,,,,,,,,,,,,,,,,
Frozen Chicken, Moong Dal, Namkeen, Other Dals, Phenyles & Acids, Raw Rice, Toor Dal, Urad Dal, Whole Spices,,,,,,,,,,,,,,,,,,,
Beans, Boiled Rice, Bread, Gourd & Cucumber, Moong Dal, Root Vegetables,,,,,,,,,,,,,,,,,,,,,,
Beans, Other Rice Products, Other Vegetables, Raw Rice, Root Vegetables,,,,,,,,,,,,,,,,,,,,,,,
Organic Rice & Rice Products, Other Rice Products,,,,,,,,,,,,,,,,,,,,,,,,,,
Beans, Other Vegetables, Root Vegetables, Whole Spices,,,,,,,,,,,,,,,,,,,,,,,,
Banana, Cashews, Other Dry Fruits, Raisins, Raw Rice, Whole Spices,,,,,,,,,,,,,,,,,,,,,,
Bread, Moong Dal, Organic F&V, Other Dals, Other Rice Products, Root Vegetables,,,,,,,,,,,,,,,,,,,,,,
Beans, Gourd & Cucumber, Mosquito Repellent, Other Dals, Other Vegetables, Root Vegetables,,,,,,,,,,,,,,,,,,,,,,
Avalakki / Poha, Basmati Rice, Besan, Ghee, Jaggery, Maida, Moong Dal, Other Dals, Raw Peanuts, Raw Rice, Rice Flour, Shampoo, Sooji & Rava, Sugar, Toor Dal, Whole Spices,,,,,,,,,,,,
Avalakki / Poha, Boiled Rice, Moong Dal, Other Rice Products, Raw Rice, Sooji & Rava, Sugar, Toor Dal, Urad Dal, Whole Spices,,,,,,,,,,,,,,,,,,
Beans, Face Cream, Other Dals, Other Rice Products, Root Vegetables, Sooji & Rava, Toor Dal,,,,,,,,,,,,,,,,,,,,,
Cashews, Exotic Vegetables, Other Rice Products, Root Vegetables, Sooji & Rava, Sugar, Whole Spices,,,,,,,,,,,,,,,,,,,,,
Beans, Boiled Rice, Gourd & Cucumber, Jaggery, Other Rice Products, Other Vegetables, Sooji & Rava, Sunflower Oils, Toor Dal, Urad Dal,,,,,,,,,,,,,,,,,,
Beans, Gourd & Cucumber, Honey, Other Vegetables, Root Vegetables,,,,,,,,,,,,,,,,,,,,,,,
Namkeen, Snacky Nuts,,,,,,,,,,,,,,,,,,,,,,,,,,
Banana, Beans, Bread, Gourd & Cucumber, Organic Dals & Pulses, Organic F&V, Organic Flours, Root Vegetables, Snacky Nuts,,,,,,,,,,,,,,,,,,,
Avalakki / Poha, Basmati Rice, Exotic Vegetables, Ghee, Ground Coffee, Healthy & Digestive Biscuits, Jaggery, Maida, Oats, Other Dals, Other Dry Fruits, Other Flours, Raw Peanuts, Raw Rice, Sooji & Rava, Sugar, Toor Dal, Urad Dal, Whole Spices,,,,,,,,,
Hand Wash, Other Dals, Other Vegetables, Raw Rice, Root Vegetables,,,,,,,,,,,,,,,,,,,,,,,
Butter & Cream, Exotic Vegetables, Organic F&V, Other Vegetables, Raw Peanuts, Raw Rice, Sugar, Toor Dal,,,,,,,,,,,,,,,,,,,,
Avalakki / Poha, Beans, Gourd & Cucumber, Liquid Soaps & Bars, Oats, Other Vegetables, Root Vegetables,,,,,,,,,,,,,,,,,,,,,
Banana, Beans, Other Dals, Root Vegetables, Whole Spices,,,,,,,,,,,,,,,,,,,,,,,
Banana, Beans, Organic F&V, Other Dry Fruits, Ready Mix, Root Vegetables, Sugar, Vermicelli,,,,,,,,,,,,,,,,,,,,
Banana, Organic F&V, Sugar,,,,,,,,,,,,,,,,,,,,,,,,,
Beans, Liquid Soaps & Bars, Sugar, Whole Spices,,,,,,,,,,,,,,,,,,,,,,,,
Besan, Raisins, Root Vegetables,,,,,,,,,,,,,,,,,,,,,,,,,
Cooking Sauce, Organic Masalas & Spices,,,,,,,,,,,,,,,,,,,,,,,,,,
Beans, Chips, Gourd & Cucumber, Ice Creams & Desserts, Namkeen, Rice Flour,,,,,,,,,,,,,,,,,,,,,,
Beans, Gourd & Cucumber, Organic F&V, Raw Peanuts,,,,,,,,,,,,,,,,,,,,,,,,
Banana, Besan, Gourd & Cucumber, Hair Oil, Health Drinks, Toor Dal,,,,,,,,,,,,,,,,,,,,,,
Banana, Beans, Besan, Chips, Other Vegetables, Raw Rice, Sooji & Rava, Toor Dal,,,,,,,,,,,,,,,,,,,,
Banana, Beans, Instant Noodles, Other Dals, Raw Rice, Root Vegetables, Sugar, Whole Spices,,,,,,,,,,,,,,,,,,,,
Beans, Organic Dals & Pulses, Root Vegetables,,,,,,,,,,,,,,,,,,,,,,,,,
Chips, Curd, Namkeen,,,,,,,,,,,,,,,,,,,,,,,,,
Banana, Organic F&V, Raw Peanuts, Whole Spices,,,,,,,,,,,,,,,,,,,,,,,,
Besan, Cashews, Cooking Paste, Other Dry Fruits, Sooji & Rava,,,,,,,,,,,,,,,,,,,,,,,
Basmati Rice, Organic F&V,,,,,,,,,,,,,,,,,,,,,,,,,,
Energy Drinks,,,,,,,,,,,,,,,,,,,,,,,,,,,
Banana, Beans, Moong Dal, Organic F&V, Root Vegetables, Snacky Nuts,,,,,,,,,,,,,,,,,,,,,,
Honey, Sanitary Pads,,,,,,,,,,,,,,,,,,,,,,,,,,
Toor Dal,,,,,,,,,,,,,,,,,,,,,,,,,,,
Raw Rice,,,,,,,,,,,,,,,,,,,,,,,,,,,
Beans, Gourd & Cucumber, Other Vegetables,,,,,,,,,,,,,,,,,,,,,,,,,
Gourd & Cucumber, Other Vegetables, Raw Peanuts,,,,,,,,,,,,,,,,,,,,,,,,,
Beans, Organic F&V, Other Dals, Urad Dal, Whole Spices,,,,,,,,,,,,,,,,,,,,,,,
Beans, Exotic Vegetables, Other Vegetables, Root Vegetables,,,,,,,,,,,,,,,,,,,,,,,,
Banana, Curd, Other Vegetables,,,,,,,,,,,,,,,,,,,,,,,,,
Cream Biscuits, Powdered Spices, Sugar, Whole Spices,,,,,,,,,,,,,,,,,,,,,,,,
Beans, Other Vegetables, Sooji & Rava,,,,,,,,,,,,,,,,,,,,,,,,,
Banana, Moong Dal, Other Vegetables,,,,,,,,,,,,,,,,,,,,,,,,,
Ice Creams & Desserts, Other Dals, Sooji & Rava, Whole Spices,,,,,,,,,,,,,,,,,,,,,,,,
Sugar,,,,,,,,,,,,,,,,,,,,,,,,,,,
Beans, Gourd & Cucumber, Whole Spices,,,,,,,,,,,,,,,,,,,,,,,,,
Avalakki / Poha, Basmati Rice, Curd, Moong Dal, Namkeen, Toor Dal, Whole Spices,,,,,,,,,,,,,,,,,,,,,
Exotic Vegetables, Gourd & Cucumber, Organic Dals & Pulses, Organic F&V, Organic Flours, Root Vegetables, Shaving Cream, Foam & Gels,,,,,,,,,,,,,,,,,,,,
Avalakki / Poha, Boiled Rice, Other Rice Products, Raw Rice, Shaving Brush, Urad Dal, Whole Spices,,,,,,,,,,,,,,,,,,,,,
Aluminium Foil & Cling Wrap, Beans, Bread, Other Vegetables, Root Vegetables, Sugar,,,,,,,,,,,,,,,,,,,,,,
Organic F&V, Other Vegetables, Root Vegetables,,,,,,,,,,,,,,,,,,,,,,,,,
Avalakki / Poha, Gourd & Cucumber, Other Dals, Other Vegetables, Raw Rice, Sooji & Rava, Sugar,,,,,,,,,,,,,,,,,,,,,
Banana, Beans, Boiled Rice, Other Rice Products, Other Vegetables, Root Vegetables,,,,,,,,,,,,,,,,,,,,,,
Maida, Mango Juices, Raisins, Shaving Blade & Razors, Shoe Polish,,,,,,,,,,,,,,,,,,,,,,,
Exotic Vegetables, Organic F&V,,,,,,,,,,,,,,,,,,,,,,,,,,
Disposable Plates & Utensils, Exotic Vegetables, Root Vegetables,,,,,,,,,,,,,,,,,,,,,,,,,
Ground Coffee, Other Dals, Other Vegetables,,,,,,,,,,,,,,,,,,,,,,,,,
Beans, Cream Biscuits, Gourd & Cucumber, Honey, Other Vegetables, Root Vegetables, Toor Dal,,,,,,,,,,,,,,,,,,,,,
Namkeen, Organic F&V, Other Juices, Snacky Nuts,,,,,,,,,,,,,,,,,,,,,,,,
Boiled Rice, Ground Coffee, Moong Dal, Other Dals, Raw Peanuts, Toor Dal, Urad Dal, Whole Spices,,,,,,,,,,,,,,,,,,,,
Other Vegetables,,,,,,,,,,,,,,,,,,,,,,,,,,,
Beans, Boiled Rice, Bread, Maida, Other Dals, Other Oils, Other Vegetables,,,,,,,,,,,,,,,,,,,,,
Basmati Rice, Beans, Cooking Paste, Other Dals, Other Vegetables, Powdered Spices, Sooji & Rava, Toor Dal, Whole Spices,,,,,,,,,,,,,,,,,,,
Exotic Vegetables, Other Oils, Sooji & Rava,,,,,,,,,,,,,,,,,,,,,,,,,
Banana, Gourd & Cucumber, Organic F&V, Organic Flours, Organic Masalas & Spices, Organic Rice & Rice Products, Raw Peanuts,,,,,,,,,,,,,,,,,,,,,
Exotic Vegetables, Moong Dal,,,,,,,,,,,,,,,,,,,,,,,,,,
Beans, Root Vegetables,,,,,,,,,,,,,,,,,,,,,,,,,,
Avalakki / Poha, Beans, Mustard Oils, Other Rice Products, Toor Dal, Toothpaste, Whole Grains, Whole Spices,,,,,,,,,,,,,,,,,,,,
Banana, Jaggery, Sugar, Sunflower Oils, Urad Dal, Whole Spices,,,,,,,,,,,,,,,,,,,,,,
Avalakki / Poha, Banana, Cashews, Raisins, Raw Rice,,,,,,,,,,,,,,,,,,,,,,,
Beans, Glucose, Marie & Milk Biscuits, Health Drinks, Organic Dals & Pulses, Organic Flours, Organic Salt,Sugar & Jaggery,,,,,,,,,,,,,,,,,,,,
Beans, Exotic Vegetables, Ground Coffee, Organic F&V, Other Vegetables, Root Vegetables,,,,,,,,,,,,,,,,,,,,,,
Beans, Festive Gift Packs, Root Vegetables,,,,,,,,,,,,,,,,,,,,,,,,,
Chips, Cooking Paste, Jaggery, Moong Dal, Other Flours, Pet Food, Sooji & Rava, Toothpaste,,,,,,,,,,,,,,,,,,,,
Beans, Gourd & Cucumber, Moong Dal, Other Dals, Other Vegetables, Raw Rice, Sooji & Rava, Sugar, Whole Spices,,,,,,,,,,,,,,,,,,,
Beans, Gourd & Cucumber, Organic F&V, Other Rice Products, Other Vegetables, Toothpaste,,,,,,,,,,,,,,,,,,,,,,
Banana, Beans, Glucose, Marie & Milk Biscuits, Gourd & Cucumber, Other Rice Products, Other Vegetables, Whole Spices,,,,,,,,,,,,,,,,,,,,
Beans, Other Rice Products, Powdered Spices, Sooji & Rava,,,,,,,,,,,,,,,,,,,,,,,,
Hair Oil, Liquid Soaps & Bars, Organic Masalas & Spices, Other Vegetables,,,,,,,,,,,,,,,,,,,,,,,,
Beans, Curd, Exotic Vegetables, Gourd & Cucumber, Milk Drinks, Organic F&V, Other Vegetables, Ready Baking Mixes, Root Vegetables,,,,,,,,,,,,,,,,,,,
Banana, Beans, Exotic Vegetables, Gourd & Cucumber, Jaggery, Moong Dal, Mosquito Repellent, Organic F&V, Other Dals, Other Vegetables, Root Vegetables, Sugar, Toor Dal, Urad Dal, Whole Spices,,,,,,,,,,,,,
Beans, Gourd & Cucumber, Moong Dal, Other Vegetables, Sooji & Rava, Whole Spices,,,,,,,,,,,,,,,,,,,,,,
Beans, Bread, Namkeen, Other Dals,,,,,,,,,,,,,,,,,,,,,,,,
Boiled Rice, Bread, Cakes, Organic Dals & Pulses, Organic Masalas & Spices, Other Dals, Other Rice Products, Raw Rice, Sooji & Rava, Whole Spices,,,,,,,,,,,,,,,,,,
Banana, Beans, Glucose, Marie & Milk Biscuits, Gourd & Cucumber, Rice Flour,,,,,,,,,,,,,,,,,,,,,,
Banana, Beans, Organic F&V, Root Vegetables, Snacky Nuts,,,,,,,,,,,,,,,,,,,,,,,
Beans,,,,,,,,,,,,,,,,,,,,,,,,,,,
Cooking Sauce, Diapers & Wipes, Hair Oil, Namkeen, Organic F&V, Other Vegetables, Root Vegetables,,,,,,,,,,,,,,,,,,,,,
Exotic Vegetables,,,,,,,,,,,,,,,,,,,,,,,,,,,
Face Packs & Scrubs, Ground Coffee, Liquid Soaps & Bars, Mango Juices, Root Vegetables,,,,,,,,,,,,,,,,,,,,,,,
Chips, Ice Creams & Desserts, Ready Baking Mixes,,,,,,,,,,,,,,,,,,,,,,,,,
Beans, Besan, Organic F&V, Other Vegetables,,,,,,,,,,,,,,,,,,,,,,,,
Honey, Instant Noodles, Other Vegetables, Packaged Drinking Water,,,,,,,,,,,,,,,,,,,,,,,,
Avalakki / Poha, Sooji & Rava, Urad Dal, Whole Spices,,,,,,,,,,,,,,,,,,,,,,,,
Cashews, Maida, Organic Salt,Sugar & Jaggery, Other Rice Products, Raisins, Rice Flour, Vermicelli, Whole Spices,,,,,,,,,,,,,,,,,,,
Aluminium Foil & Cling Wrap, Banana, Beans, Besan, Ghee, Health Drinks, Liquid Soaps & Bars, Other Dals, Other Vegetables, Raw Rice, Ready Mix, Root Vegetables, Sooji & Rava, Sugar, Sunflower Oils, Toor Dal, Toothpaste, Vermicelli,,,,,,,,,,
Beans, Ghee, Root Vegetables, Sugar,,,,,,,,,,,,,,,,,,,,,,,,
Beans, Boiled Rice, Mango Juices, Other Vegetables, Root Vegetables, Sugar,,,,,,,,,,,,,,,,,,,,,,
Beans, Other Dals, Other Rice Products, Root Vegetables, Whole Spices,,,,,,,,,,,,,,,,,,,,,,,
Avalakki / Poha, Other Dals, Raw Rice, Sooji & Rava, Whole Spices,,,,,,,,,,,,,,,,,,,,,,,
Boiled Rice, Namkeen, Other Rice Products, Other Vegetables, Raw Rice, Sunflower Oils, Toor Dal, Whole Spices,,,,,,,,,,,,,,,,,,,,
Namkeen,,,,,,,,,,,,,,,,,,,,,,,,,,,
Healthy & Digestive Biscuits,,,,,,,,,,,,,,,,,,,,,,,,,,,
Beans, Other Vegetables, Root Vegetables, Urad Dal,,,,,,,,,,,,,,,,,,,,,,,,
Banana, Cashews, Organic F&V, Other Dry Fruits,,,,,,,,,,,,,,,,,,,,,,,,
Beans, Jaggery, Other Vegetables, Raw Peanuts, Rice Flour, Sooji & Rava, Sunflower Oils, Urad Dal,,,,,,,,,,,,,,,,,,,,
Other Flours, Other Vegetables, Pet Food, Root Vegetables, Sooji & Rava, Whole Spices,,,,,,,,,,,,,,,,,,,,,,
Health Drinks, Other Vegetables, Root Vegetables,,,,,,,,,,,,,,,,,,,,,,,,,
Beans, Gourd & Cucumber, Moong Dal, Other Dals,,,,,,,,,,,,,,,,,,,,,,,,
Banana, Beans, Bread, Curd, Glucose, Marie & Milk Biscuits, Gourd & Cucumber, Organic Rice & Rice Products, Other Dals, Root Vegetables, Sunflower Oils, Toor Dal,,,,,,,,,,,,,,,,
Organic F&V,,,,,,,,,,,,,,,,,,,,,,,,,,,
Avalakki / Poha, Beans, Gourd & Cucumber, Other Vegetables, Root Vegetables,,,,,,,,,,,,,,,,,,,,,,,
Beans, Face Cream, Gourd & Cucumber, Liquid Soaps & Bars,,,,,,,,,,,,,,,,,,,,,,,,
Sugar, Whole Spices,,,,,,,,,,,,,,,,,,,,,,,,,,
Glucose, Marie & Milk Biscuits,,,,,,,,,,,,,,,,,,,,,,,,,,
Avalakki / Poha, Banana, Mosquito Repellent, Other Dry Fruits, Regular Pasta, Sooji & Rava, Toor Dal,,,,,,,,,,,,,,,,,,,,,
Antiseptics, Cakes, Ice Creams & Desserts, Namkeen,,,,,,,,,,,,,,,,,,,,,,,,
Other Vegetables,,,,,,,,,,,,,,,,,,,,,,,,,,,
Banana, Basmati Rice, Beans, Bread, Glucose, Marie & Milk Biscuits, Gourd & Cucumber, Namkeen, Organic F&V,,,,,,,,,,,,,,,,,,,
Beans, Boiled Rice, Cashews, Cooking Paste, Other Vegetables, Shoe Polish, Sugar, Sunflower Oils, Urad Dal,,,,,,,,,,,,,,,,,,,
Cooking Sauce, Gourd & Cucumber, Organic F&V, Other Vegetables,,,,,,,,,,,,,,,,,,,,,,,,
Beans, Organic F&V, Other Vegetables, Sugar, Toor Dal,,,,,,,,,,,,,,,,,,,,,,,
Banana, Beans, Bread, Cashews, Gourd & Cucumber, Moong Dal, Other Dals, Other Vegetables, Root Vegetables, Sooji & Rava, Toor Dal, Urad Dal, Whole Spices,,,,,,,,,,,,,,,
Cashews, Organic F&V, Raisins, Rasagulla & Gulab Jamun, Raw Peanuts, Sugar,,,,,,,,,,,,,,,,,,,,,,
Avalakki / Poha, Boiled Rice, Cashews, Ground Coffee, Hair Oil, Moong Dal, Other Dals, Other Rice Products, Raw Peanuts, Raw Rice, Toor Dal, Urad Dal, Whole Spices,,,,,,,,,,,,,,,
Instant Noodles, Regular Pasta, Root Vegetables,,,,,,,,,,,,,,,,,,,,,,,,,
Avalakki / Poha, Banana, Cashews, Maida, Organic F&V, Root Vegetables,,,,,,,,,,,,,,,,,,,,,,
Organic F&V, Other Dry Fruits, Other Vegetables,,,,,,,,,,,,,,,,,,,,,,,,,
Banana, Beans, Cashews, Cooking Sauce, Gourd & Cucumber, Health Drinks, Honey, Other Vegetables, Raisins, Raw Rice, Root Vegetables, Sugar,,,,,,,,,,,,,,,,
Beans, Glucose, Marie & Milk Biscuits, Gourd & Cucumber, Moong Dal, Other Dals, Other Vegetables, Root Vegetables, Sanitary Pads, Sooji & Rava, Vermicelli, Whole Spices,,,,,,,,,,,,,,,,
Beans, Other Dals, Root Vegetables,,,,,,,,,,,,,,,,,,,,,,,,,
Banana, Organic F&V, Other Vegetables, Root Vegetables,,,,,,,,,,,,,,,,,,,,,,,,
Jaggery, Whole Spices,,,,,,,,,,,,,,,,,,,,,,,,,,
Raw Rice, Yogurt & Lassi,,,,,,,,,,,,,,,,,,,,,,,,,,
Banana, Boiled Rice, Cream Biscuits, Glucose, Marie & Milk Biscuits, Gourd & Cucumber, Namkeen, Organic F&V, Snacky Nuts, Sunflower Oils,,,,,,,,,,,,,,,,,,
Other Vegetables, Root Vegetables,,,,,,,,,,,,,,,,,,,,,,,,,,
Banana, Besan, Honey, Jaggery, Maida, Other Dals, Other Vegetables, Raw Peanuts, Raw Rice, Regular Pasta, Rice Flour, Root Vegetables, Sugar, Whole Spices,,,,,,,,,,,,,,
Beans, Chips, Exotic Vegetables, Health Drinks, Moong Dal, Other Vegetables, Sugar, Whole Spices,,,,,,,,,,,,,,,,,,,,
Cream Biscuits, Glucose, Marie & Milk Biscuits, Organic F&V, Raw Peanuts, Whole Grains,,,,,,,,,,,,,,,,,,,,,,
Banana,,,,,,,,,,,,,,,,,,,,,,,,,,,
Avalakki / Poha, Banana, Besan, Namkeen, Organic Salt,Sugar & Jaggery, Other Sweets, Raw Peanuts,,,,,,,,,,,,,,,,,,,,
Avalakki / Poha, Beans, Cashews, Other Vegetables, Raisins, Toor Dal,,,,,,,,,,,,,,,,,,,,,,
Beans, Gourd & Cucumber, Other Vegetables,,,,,,,,,,,,,,,,,,,,,,,,,
Gourd & Cucumber,,,,,,,,,,,,,,,,,,,,,,,,,,,
Gourd & Cucumber, Other Vegetables, Sugar,,,,,,,,,,,,,,,,,,,,,,,,,
Banana, Cream Biscuits, Organic Salt,Sugar & Jaggery, Root Vegetables, Whole Spices,,,,,,,,,,,,,,,,,,,,,,
Banana, Bread, Gourd & Cucumber, Organic Dals & Pulses, Organic Flours, Organic Masalas & Spices,,,,,,,,,,,,,,,,,,,,,,
Banana, Organic F&V, Root Vegetables,,,,,,,,,,,,,,,,,,,,,,,,,
Basmati Rice,,,,,,,,,,,,,,,,,,,,,,,,,,,
Organic F&V, Root Vegetables,,,,,,,,,,,,,,,,,,,,,,,,,,
Butter & Cream, Other Dry Fruits, Rice Flour,,,,,,,,,,,,,,,,,,,,,,,,,
Beans, Hair Colors & Dyes, Namkeen, Other Rice Products, Root Vegetables, Toor Dal,,,,,,,,,,,,,,,,,,,,,,
Cooking Sauce, Curd, Organic F&V, Other Dals, Other Vegetables, Root Vegetables, Sunflower Oils, Whole Spices,,,,,,,,,,,,,,,,,,,,
Moong Dal, Other Dals, Raw Peanuts,,,,,,,,,,,,,,,,,,,,,,,,,
Banana, Beans, Cream Biscuits, Exotic Vegetables, Gourd & Cucumber, Namkeen, Other Vegetables, Root Vegetables, Sugar Cubes,,,,,,,,,,,,,,,,,,,
Banana, Other Dals, Other Vegetables, Regular Pasta,,,,,,,,,,,,,,,,,,,,,,,,
Beans, Gourd & Cucumber, Health Drinks, Other Vegetables, Root Vegetables,,,,,,,,,,,,,,,,,,,,,,,
Curd, Other Dals, Sugar,,,,,,,,,,,,,,,,,,,,,,,,,
Exotic Vegetables, Gourd & Cucumber, Organic F&V, Other Dals, Raw Peanuts, Root Vegetables, Sugar, Whole Spices,,,,,,,,,,,,,,,,,,,,
Beans, Glucose, Marie & Milk Biscuits, Gourd & Cucumber, Other Vegetables, Toor Dal,,,,,,,,,,,,,,,,,,,,,,
Boiled Rice, Maida, Moong Dal, Other Dals, Other Oils, Other Vegetables,,,,,,,,,,,,,,,,,,,,,,
Banana, Beans, Besan, Boiled Rice, Exotic Vegetables, Gourd & Cucumber, Jaggery, Maida, Moong Dal, Other Dals, Other Flours, Other Vegetables, Raw Peanuts, Rice Flour, Root Vegetables, Sugar, Toor Dal, Urad Dal, Yogurt & Lassi,,,,,,,,,
Jaggery, Other Dals,,,,,,,,,,,,,,,,,,,,,,,,,,
Beans, Gourd & Cucumber, Other Spreads, Other Vegetables, Root Vegetables, Sunflower Oils, Toor Dal,,,,,,,,,,,,,,,,,,,,,
Other Dals, Sugar Cubes, Whole Spices,,,,,,,,,,,,,,,,,,,,,,,,,
Glucose, Marie & Milk Biscuits, Other Dry Fruits, Sugar Cubes, Yogurt & Lassi,,,,,,,,,,,,,,,,,,,,,,,
Beans, Other Vegetables,,,,,,,,,,,,,,,,,,,,,,,,,,
Banana, Beans, Gourd & Cucumber, Raw Rice, Sugar,,,,,,,,,,,,,,,,,,,,,,,
Bread, Other Vegetables, Root Vegetables, Sunflower Oils,,,,,,,,,,,,,,,,,,,,,,,,
Honey,,,,,,,,,,,,,,,,,,,,,,,,,,,
Beans, Other Dals, Other Vegetables, Sooji & Rava, Sugar,,,,,,,,,,,,,,,,,,,,,,,
Avalakki / Poha, Banana, Beans, Bread, Cashews, Exotic Vegetables, Ghee, Glucose, Marie & Milk Biscuits, Health Drinks, Honey, Jaggery, Maida, Moong Dal, Organic Dals & Pulses, Other Dals, Other Dry Fruits, Other Vegetables, Raw Peanuts, Root Vegetables, Sugar, Sunflower Oils, Toor Dal, Whole Spices,,,,
Boiled Rice, Bread, Face Wash, Glucose, Marie & Milk Biscuits, Organic F&V,,,,,,,,,,,,,,,,,,,,,,
Beans, Other Dals, Other Vegetables, Raw Rice, Root Vegetables,,,,,,,,,,,,,,,,,,,,,,,
Beans, Bread, Chilli & Soya Sauces, Organic Rice & Rice Products, Other Dals, Other Vegetables, Sooji & Rava,,,,,,,,,,,,,,,,,,,,,
Banana, Gourd & Cucumber, Other Vegetables, Sugar,,,,,,,,,,,,,,,,,,,,,,,,
Other Rice Products, Raw Rice,,,,,,,,,,,,,,,,,,,,,,,,,,
Cooking Sauce, Ground Coffee, Organic F&V, Raw Rice, Root Vegetables, Toor Dal, Urad Dal,,,,,,,,,,,,,,,,,,,,,
Chinese Noodles, Honey, Other Sauces, Whole Spices,,,,,,,,,,,,,,,,,,,,,,,,
Ground Coffee, Toor Dal,,,,,,,,,,,,,,,,,,,,,,,,,,
Other Vegetables,,,,,,,,,,,,,,,,,,,,,,,,,,,
Banana, Beans, Instant Noodles, Moong Dal, Other Dals, Other Vegetables, Root Vegetables, Sugar, Toor Dal,,,,,,,,,,,,,,,,,,,
Bread, Corn Snacks, Cream Biscuits, Healthy Snacks, Namkeen, Organic F&V, Pasta & Noodles,,,,,,,,,,,,,,,,,,,,,
Organic F&V, Sunflower Oils,,,,,,,,,,,,,,,,,,,,,,,,,,
Root Vegetables,,,,,,,,,,,,,,,,,,,,,,,,,,,
Beans, Boiled Rice, Cooking Paste, Glucose, Marie & Milk Biscuits, Gourd & Cucumber, Honey, Namkeen, Organic Masalas & Spices, Root Vegetables, Whole Spices,,,,,,,,,,,,,,,,,
Glucose, Marie & Milk Biscuits, Moong Dal, Namkeen, Other Dry Fruits, Sooji & Rava,,,,,,,,,,,,,,,,,,,,,,
Bread, Cakes, Cream Biscuits, Glucose, Marie & Milk Biscuits, Organic F&V, Root Vegetables, Yogurt & Lassi,,,,,,,,,,,,,,,,,,,,
Beans, Boiled Rice, Exotic Vegetables,,,,,,,,,,,,,,,,,,,,,,,,,
Cashews, Gourd & Cucumber, Moong Dal, Other Dals, Other Dry Fruits, Raw Peanuts, Root Vegetables,,,,,,,,,,,,,,,,,,,,,
Beans, Other Vegetables, Rice Flour, Root Vegetables, Sooji & Rava, Sugar, Toor Dal, Urad Dal, Whole Spices,,,,,,,,,,,,,,,,,,,
Banana, Beans, Gourd & Cucumber, Organic F&V, Raw Peanuts,,,,,,,,,,,,,,,,,,,,,,,
Banana, Beans, Glucose, Marie & Milk Biscuits, Other Oils, Other Vegetables, Root Vegetables, Sugar,,,,,,,,,,,,,,,,,,,,
Beans, Other Dals, Root Vegetables,,,,,,,,,,,,,,,,,,,,,,,,,
Beans, Namkeen, Root Vegetables, Shampoo,,,,,,,,,,,,,,,,,,,,,,,,
Hair Oil, Health Drinks, Health Supplements, Namkeen,,,,,,,,,,,,,,,,,,,,,,,,
Gourd & Cucumber, Organic Dals & Pulses, Organic F&V, Organic Masalas & Spices, Organic Salt,Sugar & Jaggery, Root Vegetables, Sooji & Rava, Whole Spices,,,,,,,,,,,,,,,,,,,
Beans, Ground Coffee, Other Vegetables, Root Vegetables,,,,,,,,,,,,,,,,,,,,,,,,
Gourd & Cucumber, Other Vegetables, Root Vegetables,,,,,,,,,,,,,,,,,,,,,,,,,
Other Dry Fruits,,,,,,,,,,,,,,,,,,,,,,,,,,,
Namkeen, Raw Rice,,,,,,,,,,,,,,,,,,,,,,,,,,
Banana, Beans, Namkeen, Organic F&V, Other Dals, Root Vegetables, Snacky Nuts, Sunflower Oils,,,,,,,,,,,,,,,,,,,,
Organic F&V,,,,,,,,,,,,,,,,,,,,,,,,,,,
Beans, Glucose, Marie & Milk Biscuits, Mosquito Repellent, Other Vegetables, Powdered Spices, Root Vegetables, Sunflower Oils,,,,,,,,,,,,,,,,,,,,
Liquid Soaps & Bars, Moong Dal, Other Dals, Raw Peanuts, Sugar, Toor Dal,,,,,,,,,,,,,,,,,,,,,,
Beans, Cooking Paste, Exotic Vegetables, Gourd & Cucumber, Moong Dal, Other Vegetables, Root Vegetables, Whole Spices,,,,,,,,,,,,,,,,,,,,
Banana, Beans, Gourd & Cucumber, Other Sauces, Other Vegetables,,,,,,,,,,,,,,,,,,,,,,,
